comment_id,parent_id,comment_author,comment,comment_score,OPR,pos/neg view_b/hy
lol7uid,,imasturdybirdy,"It’s amazing that he calls himself a genius.

How many geniuses do you know of who regularly have to explain the ways in which they are a genius? 

There should be psychological studies done on this man’s level of narcissism.",1772,0,2
lolax2l,lol7uid,BumplimJoe,Any person who feels the need to constantly call themselves a genius is an idiot driven by ego,512,0,2
lolic3z,lolax2l,PhariseeHunter46,He belongs in r/iamverysmart,188,1,2
lolwfh7,lolic3z,froggrip,It would be too easy to flood that sub with the things he's said just in this campaign alone.,63,0,0
longp0a,lolwfh7,Living_Owl_9855,And what's wrong with that? Please proceed ??,1,0,0
lonq9ht,longp0a,froggrip,"Well, then someone would need to make a whole other sub to publicly shame those acting too big for their britches.",1,0,0
lon7764,lolic3z,hangryhyax,"No, he belongs in our memories. Mostly forgotten, but a reminder of how to be better",21,0,1
loon5v2,lon7764,Jus-Wonderin9680,No marker. Just a patch of dirt that won't grow grass.,2,0,0
lomr6it,lolic3z,ProblemLongjumping12,"He should be the mascot for that sub. 

He actually said ""I'm like a very smart person"" because he's so socially illiterate that he doesn't have any idea why people don't normally say things like that. Why that's weird. And why saying that immediately makes you sound like a dumb person. 

This is the kind of basic socialization concept that most of us have mastered by the 5th grade.",16,0,2
lopdnr3,lomr6it,Quick_Team,"Trump at Multiple Rallies: ""who remembers the great American, Hannibal Lecter?!"" ""The late great Hannibal Lecter!"" ""Hannibal Lecter, what a great American he was.""

Everyone not MAGA: ""that's weird. He's a fictional character that was a cannibal""

Trump: ""I was using it as a metaphor for illiegal immigrants.

Oh just F*ck off. All the way off.",1,0,2
lom7t19,lolic3z,ChromeYoda,It should be r/iareverysmart,26,0,0
lombd1j,lom7t19,Hungry-Lemon8008,r/IisVerySmart?,6,0,0
lomey81,lombd1j,Surface13,r/IisVurySmrt,6,0,0
loomwrv,lomey81,DARYLdixonFOOL,r/IisVuryShart,1,0,0
lort7ab,loomwrv,thegreenmonkey69,r/ibeveruhsmort,1,0,0
lophimk,lolic3z,Necessary-Lab-3624,He belongs in jail with Diddy.,2,0,2
lolzfda,lolax2l,AznNRed,Someone should introduce Trump to Kanye West. I think they'd really hit it off...,25,0,1
lop4gsf,lolzfda,thejesse,"Trump had Kanye in the Oval Office. [He pitched an idea for a new presidential plane called the ""iPlane 1.""](https://www.cnbc.com/2018/10/11/kanyes-apple-iplane-1-for-trump-was-designed-by-someone-else.html)",2,0,0
los81lm,lolzfda,Whambamthankyoulady,"They've met. Kanye visited the white house to throw ideas at Trump, then he decided to run on this own bullshit show",2,0,2
los9ute,los81lm,AznNRed,Yeah I know. I used ... instead of /s. They aren't interchangeable.,1,0,0
lom7ti9,lolax2l,SookHe,"I’ve only called myself a genius once, so that means I must be a genius.

Of course that turned out to be the one time I was wrong about something, but that is beside the point.",7,1,0
lortesf,lom7ti9,thegreenmonkey69,Once I thought I was wrong but I was mistaken,1,1,1
lom93vt,lolax2l,CaptnInsaino101,Does Wile E. Coyote: Super Genius count?,1,1,2
lomcjnn,lolax2l,jediciahquinn,"Any man who must say, ""I am the king"" is no true king. 
--Tywin Lannister",1,0,2
lomu1s8,lolax2l,Hotpandapickle,A stable genius. The bestest most stabliest genius in the biggly world.,1,1,1
lony5m4,lolax2l,Money_Percentage_630,"The fool doth think he is wise.

The Wiseman knows himself to be a fool.

Trump after reading this and misunderstanding it entirely ""I'm a genius! I'm so smart I know what a Tariff is!""",1,1,2
lop9xgn,lolax2l,MoonMistCigs,"Looking at you, Andrew Tate.",1,0,0
lor4xd6,lolax2l,AvgBonnie,So I’m not running for public office but I call myself amazing in video games every single time I touch a controller and immediately die. What does that make me?,1,1,2
lolc75m,lol7uid,SlobZombie13,And what kind of genius invites the governor of Arkansas to a town hall meeting in Michigan?,164,0,2
lolg22y,lolc75m,gods_Lazy_Eye,Who increasingly looks like she’s fighting off crying just while listening to him rant about how he doesn’t rant.,134,0,0
lolgw4e,lolg22y,ith-man,"She doesn't have feelings to cry with. She's a horrible person who wants to ride Trump's dick... Rolled back child labor laws, sends tax money from public to private schools, stole 20k in tax payer money to go on a European vacation...

Fuck Huck a boo boo.",179,0,2
lolynj3,lolgw4e,cosmic_scott,"there's SOMETHING happening behind her eyes during his reply.

at one point i think utter realization kicked in, and she shoved it back down with a vapid smile.

but she DEFINITELY knows he is losing what little brainpower he started with.",45,0,0
lomg2y4,lolynj3,RoguePlanet2,She's getting plenty of Russian money to play this part. Suck it up buttercup.,22,0,2
lome2we,lolynj3,Anon65583,Maybe she was just farting. ??,15,0,1
lomkpwx,lome2we,polaarbear,Or she got a whiff of the diaper ??????????,14,0,1
lomdhdx,lolynj3,PomeloPepper,"And the natural conclusion that he won't even remember whatever he promised her, much less deliver it.",2,0,0
lomb71i,lolgw4e,supa325,"Ugh, that's an image I could have done without picturing.",1,0,0
lomcoh3,lolgw4e,Anonybibbs,Is that a Rat Pfink a Boo Boo reference?,1,0,0
loo83vf,lolgw4e,Hoopy_Dunkalot,What happened to her husband? Didn't Fox try to make something out of him?,1,0,0
lolrj4c,lolg22y,Rhesusmonkeydave,I didn’t think I was capable of sympathy for SHS but she really does have a fear/shame vibe reminiscent of Ashley from The Boys here thats hard not to feel for.,8,0,0
loltp8h,lolrj4c,Guy954,"Nah, she deserves any scrap of shame and discomfort that can be healed upon her.",20,0,2
lomgu1b,lolto6y,yoyodaddy,A comment so nice I liked it twice,5,0,0
loluas5,lolto6y,Rhesusmonkeydave,°_O,1,0,0
loniwxy,lolg22y,Next_Boysenberry1414,I am 100% sure trump fucked her at some point. She had whatever Melania had.,2,0,2
lolmbrk,lolc75m,Ill_Pace_9020,Honestly they can keep her. She has done so much harm to this state it's on its way to becoming Florida 2.0.,38,0,2
lolp5yu,lolmbrk,taxiecabbie,"Michigan can keep her?

No, no, no. We're keeping Whitmer, thank you. We're good.",28,0,0
lom2dbj,lolp5yu,VeronicaLD50,fr. Huckabitch ? Pure Michigan,2,0,0
lommlu3,lom2dbj,taxiecabbie,This made me cackle. Thanks.,1,0,1
lolhogi,lolc75m,DMV2PNW,That’s why he is a genuis. No one see this stealth move./s,6,0,1
lom5u9j,lolc75m,No_Use_4371,She's an evil bitch and his biggest fan.,2,0,2
lonoo70,lolc75m,Particular_Squash995,Her neck looks like ET,1,0,2
loljvfc,lol7uid,Pitiful_Winner2669,"My family friend works in robotics for factories. He did some work for a nuclear power plant, literally out of curiosity. Like it was a fucking hobby. He's the smartest person I know personally. 

He briefly mentioned one time that he was ""underwhelmed,"" about his understanding of his field of work.",40,0,0
lolqdc7,loljvfc,tjean5377,"Yeah. truly scarily smart and intelligent people are oblivious to it and don´t care to ruminate to you how smart they are. My best friend married a guy who owns the patent for a type of catheter that pulls blood clots out of your brain, he has a masters in epidemiology and in Ph.D (I have no idea in what) and works in biomedical plastics manufacturing engineering. I think he has a bit of the tism in how he communicates. His brain wave and when talking conversation is so esoteric and dry but he also has a humor that is quite unique. I cannot beat the guy at scrabble how hard I try by the order of hundreds of points. He kept playing me though. He tells us about his job, and his day to day like we understand it but not in a condescending way. He geniunely is sharing. He´s brilliant...and really doesn´t show it or know it it his way.",44,0,0
lolragw,lolqdc7,Pitiful_Winner2669,"Almost word for word, that's my family friend. Right down to Scrabble lol. 

Not condescending, has a sense of humor and is slightly nervous socially. We go backpacking with my mom and I love to tap his brain on subjects. He's very matter-of-fact and is incredible explaining topics to a dolt like me.

Salt of the earth, he is. I am fortunate to have been friends with him from 11-35.",23,0,1
lolxijp,lolragw,tjean5377,"I truly enjoy speaking with intelligent, smart, or just plain interesting eloquent people. It tickles my brain. That's why the Idiocracy of the right wing is making me feel downright hopeless and helpless. I ran into a biosystems scientist the other day (I am a home care nurse) he was feeling a weakness that wasn't kosher with the surgery he had so I was questioning him about what was going on. His particular malady was so rare that I had to keep asking him questions in a way that surprised him because most nurses don't go into such detail. I genuinely wanted to learn and in the course of learning about his rare thing it helped me better understand another more common thing in a better way. He was so effusive in his appreciation of my thoroughness that he signed a textbook he wrote about ocean systems so I could learn more. My job can be a slog sometimes but stuff like this just makes me love my job more.",8,0,0
lomh1xd,lolxijp,RoguePlanet2,"My husband has GOT to be on the spectrum, and has learned how to mask pretty well. He researches damn near everything and always knows the CORRECT way of doing it all. Can be infuriating, but I have to trust that he's got his reasons for doing things a certain way.

He's currently shopping for a new truck/SUV. The other night, he talked to his brother about trucks for almost an hour. Anything that needs to be fixed, he'll read up on it if needed, but usually already knows how to do the repairs. But if he doesn't want to do it himself, it likely won't ever get done (unless necessary) because he doesn't trust anybody else to do the job right.",3,0,0
lonvq5u,lomh1xd,tjean5377,It's a single mindedness that is not limited. It's a strange thing and quirk but it's not harmful. It part of your love too no doubt. So cool too but I understand the frustration!,3,0,1
loqih6r,lonvq5u,RoguePlanet2,"The mansplaining helps to keep other women away ?? and I'm glad he's so thorough, but thinks he's immune to emotional decisions- far from it! ??",1,0,0
lolzolh,lolxijp,Pitiful_Winner2669,"Thoroughly enjoyed reading this, thanks for sharing! Neat how he wrote about ocean systems and still there was a parallel with what you do as an in home care nurse. 

Also! I live with my MIL who has an in care nurse, who is also a huge science nerd. That's funny, there's gotta be a connection there. Her hobby is growing vegetables to perfection. Her set up is wild lol",2,0,0
lolo6f4,loljvfc,Magic_Man_Boobs,Yeah my SIL and BIL both have doctorates in different scientific fields and they both will complain about how little they understand. It's nuts being around people that smart.,18,0,0
loo8o9c,lolo6f4,Stainless-S-Rat,"The interesting thing about smart people is that they are very aware that they know a lot, but they acknowledge they can't know everything.

The interesting thing about unintelligent people is that they know everything.",2,0,0
looomat,loljvfc,xChoke1x,"My dad’s best friend was a Mensa member, and worked for the DoD. Dude was a trip. It was so wild watching him be so bored with complex equations. He passed away a couple years ago to cancer and we miss him a lot.",1,0,0
loljdmu,lol7uid,dahbakons_ghost,"To paraphrase the late Adam West, 
""i didn't need to tell people i was a genius, i talked and they knew i was a genius""",12,0,0
loldx9q,lol7uid,seweso,"He's a narcissistic dunning kruger sociopath. 

Not all stupid people think they are smart right? That requires narcissism?",28,0,2
lood279,loldx9q,SnollyG,Doesn’t Dunning-Kruger need you to actually be good at something (that then makes you think you’re good at everything)?,1,0,0
loofbdl,lood279,seweso,No that's Ultracrepidarianism. Although I belief there is a simpler term for it.,1,0,0
lop0e0t,loofbdl,SnollyG,Ah. Thanks,1,0,0
lolefcl,lol7uid,back2basics13,"""I don't know quite how to tell you this, but I'm kind of a big deal. People know me. I'm very popular. I have many leather bound books and my apartment smells of rich mahogany""",20,1,0
lonjjbr,lolefcl,Surreply,"??????????

Oh, Ron.",2,0,0
loq45hq,lolefcl,formercolloquy,I’m friends with Merlin Olsen. He comes over sometimes.,2,0,0
lolfm0d,lol7uid,No_Construction_7518,People that loudly proclaim their wealth or intelligence are usually lacking in both.,17,0,2
lolgajr,lol7uid,hikeyourownhike42069,"Makes me wonder how much his dad put him down when he was young. He was a tremendous asshole. Donald himself brow beats his kids pretty heavily, calling them stupid. Not sure about Ivanka though. Weird dynamic there.",14,0,2
lolhlq5,lolgajr,FriendOfTheDevil2980,He's for sure never once thought about Ivanka's IQ,8,0,0
lomomot,lolgajr,Jroth225,"I worked with a guy like that. Worst human I’ve ever met in a professional setting. I’m certain that he came home every day from grade school after being beat up by the school bully. As he cried while walking in the house his dad would ask, WTF are you crying for?” And he’d reply “I got beat up again by the bully. He said I was fat and ugly!” To which his father would have said “well then, you clearly deserved the beating because you fit that description perfectly!”",2,0,2
lolmgq4,lol7uid,goochgrease2,"It usually goes the other direction in my experience. I have a friend who is a mensa member and he is the most humble person I know. Slightly self deprecating at times, too. He is an extreme example, but the point is that actual genius' don't need to convince anyone. It's pretty apparent when talking to them.",9,0,1
lolkylk,lol7uid,jdbolick,"It's not amazing. Donald Trump is *incredibly* insecure. That may be the only category in which he actually is exceptional, as he's not just saying these affirmations for the audience, he's telling himself like a demented Stuart Smalley. 

Trump is delusional, but even delusional people notice when other people react to their statements with incredulity. He's seen it from doctors, generals, advisors, and everyone. Those looks of disbelief, disgust, and disapproval are what drive his constant need for validation.",10,0,2
lomaxjl,lolkylk,richwat00,"I need to thank you..You just said what my brain thinks. Except when I say it, all that comes out is, "" Trump is an insecure, ego driven idiot"". You added the manipulative aspect (validation) in a way that makes total sense now . The missing puzzle piece for me: Affirmations ??.",3,0,0
lolessz,lol7uid,AlexPsyD,We have those studies...but they are typically on inmates and inpatients,4,0,0
lomnnj7,lolessz,Clever_Mercury,So they're applicable here.,2,0,0
lolkll3,lol7uid,bulking_on_broccoli,"He will be a case study for years to come, once this country has realized that half its population lost their collective minds by supporting someone who would be clinically diagnosed with a mental disorder if he was literally any other person whose name wasn’t Trump.",6,0,2
lollphc,lol7uid,FaultyToenail,There will be. I don’t doubt some are under way as we speak,5,0,0
lolyvcb,lol7uid,a_printer_daemon,"Musk trained an army of ass holes to tell everyone he is a genius.

Don't know if that is worse or better. XD",5,0,0
lollofh,lol7uid,Gourmeebar,I’d say it’s about the same number of people who brag about passing a cognitive test…With flying colors,3,0,2
lolnw5y,lol7uid,username_not_found0,"The only time I ever see people calling themselves a genius are when they're being deeply sarcastic, or random moments of actual minor brilliance",2,0,0
loloqz7,lol7uid,Vanstoli,"For decades and decades. Unless he wins, then there will be no studies. Of anything",2,0,0
lolp3i9,lol7uid,Putrid-Rub-1168,People who are awesome at anything so not brag about it. They'll actually talk down their abilities. Other people brag about how awesome they are. Narcissists who are fucking retarded and terrible at things will always brag about how awesome they are.,2,0,2
lolt5au,lol7uid,Itool4looti,"And a stable one, at that. Bwahahaha!!!",2,1,2
loly8wj,lol7uid,i_8_the_Internet,Give it about 15 years.,2,0,0
lom0wl2,lol7uid,RequirementOne7370,"You can apply that to almost anything. Examples include, ""Im a good person,"" ""I'm a nice person,"" ""I'm a smart person."" Typically if you have to proclaim you are XXXXXX to someone, it's usually because your actions indicate you're the exact opposite.",2,0,2
lom21qx,lol7uid,MrTurkle,"Just for the record, anyone who has to explain the ways in which they are “x” are usually not - a true master doesn’t have to assert thier achievements, others do it for them.",2,0,2
lolkov4,lol7uid,ExistentialFread,Mr. Dunning Kruger told him so,1,0,0
lolnhky,lol7uid,RoebuckThirtyFour,Ryder the shermhead,1,0,0
lolqrti,lol7uid,kymilovechelle,"She knows. 

She knows she’s going in the history books next to the new Hitler.",1,0,0
lolt4vt,lol7uid,WhoUMe2,"There is only one genius who has to regularly explain he is a genius. What to take a guess? Now, how genius is that. lol",1,1,2
lom03av,lol7uid,Handleton,">There should be psychological studies done on this man’s level of narcissism.

There have been. For years. The problem is that his voters don't really care about it.",1,0,2
lom3wfn,lol7uid,Der_Bonehead,Along with his slowly developing dementia,1,0,2
lom3wh6,lol7uid,moistdri,Every maga has to explain WhAt hE rEaLlY MeAns..... its weird.,1,0,2
lom5ggv,lol7uid,MyBllsYrChn,"Well, if he doesn't say it, no one eles will.",1,0,0
lomat7b,lol7uid,Objective-War-1961,Will E Coyote is a better genius than trump and he gets runed over by trains.,1,0,2
lome0hb,lol7uid,anythingMuchShorter,"He even kind of slurred the word ""genius""

""no no dats not rambling dats geenuze""",1,0,2
lomfpf6,lol7uid,WockyTamer,"It’s textbook narcissistic personality disorder. It’s not new. He’s an archetypal villain as old as time.


“The DSM-5 code for narcissistic personality disorder is 301.81 (F60.81). 

Narcissistic personality disorder (NPD) is a personality disorder that’s characterized by a persistent pattern of grandiosity, lack of empathy, and a need for admiration. Some of the clinical features of NPD include: 

Having a grandiose sense of self-importance 

Exaggerating achievements and talents 

Expecting to be recognized as superior 

Being preoccupied with fantasies of success, power, beauty, and idealization 

Having a sense of entitlement 

Being interpersonally exploitative 

Lacking empathy 

Being envious of others 

Showing arrogant or haughty behaviors”",1,0,2
lomhtw9,lol7uid,hunstinx,He is even rambling when responding to the rambling accusations!!,1,0,2
lomilvy,lol7uid,Quiet-Fox-1621,I feel like he’s setting himself up to claim insanity so he can stay out of jail when he loses the election. Throw a straight jacket on the guy Nov 6 and get the soft walled room ready.,1,0,2
lomixp4,lol7uid,adamdreaming,"Dude has one move; stay on the offensive.

The dumber his shit is the more he *needs* to claim insane levels of intelligence.

It works too.

How’s the conversation about nation wide racism with conservatives going? Oh, it got derailed to argue about if immigrants are *actually* eating cats or not? We got tricked into arguing about stupid conspiracy theories instead of the underlying racism *AGAIN ?*

They only have one move and it has no nuance and they use it because it works and the left always falls for it, lest they be accused of ever arguing in bad faith",1,0,2
lomiyff,lol7uid,Excusemesorry44,There are! And there will be so many more about the magat phenomenon.,1,0,0
lomiz3c,lol7uid,tsunamiforyou,And what if the studies showed that he was actually the geniusest of them all by big number? By sig figs?!,1,1,1
lomj01m,lol7uid,Iamthepaulandyouaint,"Ya but during one of his verbal diarrhea ramblings he said “us” in a sentence. Then proceeded to say how that also is U.S.
That he was the only one to think of that, nobody had come up with that before.
And you don’t think he’s a genius.",1,1,2
lomjvsq,lol7uid,Old-Zookeepergame500,"How would you fix the economy? “as you know I grew up middle class, the folks in my neighborhood loved their lawns” atleast the man explains what he will enact unlike the other",1,1,0
lomkwgc,lol7uid,manaha81,Oh there will be,1,0,0
loml6ev,lol7uid,3bugsdad,"If you have to tell others you're a genius, it means you're an imbecile.",1,0,2
lomn4cl,lol7uid,Zethras28,"When he dies, they need to dissect his brain down to the neuron and see precisely what is wrong with him, aside from the McDonald’s and Alzheimer’s.",1,0,2
lomq5me,lol7uid,luke-juryous,"Technically speaking, anyone with 130 or higher is a “genius”. I have about 200 friends on FB. So statistically, I know 4 geniuses. Exactly 0 of them have ever claimed that status.",1,0,0
lomq6k9,lol7uid,Vantriss,"Anyone who has to say, ""I am a genius"" is no true genius.",1,0,0
lomqmje,lol7uid,ProblemLongjumping12,"There sort of are. 

Watch #Unfit on Prime and you'll see some of the greatest mines in Psychology way in about their opinions on the orange wet fart. 

Spoiler alert, he's 100% a malignant narcissist which makes him paranoid and sadistic among other traits. Other famous cases of his condition have included Ted Bundy and John Wayne Gacy",1,0,0
lomqogq,lol7uid,CautiousEmergency367,How many of the also think asylum seekers come from mental asylums?,1,0,0
lomsc0f,lol7uid,throwaway0134hdj,"It almost seems like a joke or an act, but which is why ppl are willful ignorant of it. Ppl don’t realize it’s real, there does this level of narcissism and they believe what they say, it’s not an act.",1,0,2
lomtc76,lol7uid,highphiv3,I'm sure his level of narcissism is shared by hundreds of thousands of people. The only stunning part is how many people are totally bought-in on his inflated self-image.,1,0,2
lomyzyu,lol7uid,El_Cid_Campi_Doctus,">And any man who must say 'I am king' is no true king at all.

George RR Martin, A Storm of Swords",1,0,0
lon01l0,lol7uid,hunnybolsLecter,"There was collaborative book published by a large team of psychologists and psychiatrists called, I think, ""The danger of Trump"", during the 2016 election. Do you think anyone cared? Not many. 

This is a world of populist politics these days.",1,0,2
lon1rx8,lol7uid,FIDoAlmighty,There will be after he dies.,1,0,2
lon3izv,lol7uid,Justinmytime,During a doctor fill interview he said “Jesus would vote for him and he’s better the Jesus “ -tRump,1,0,0
lon4kis,lol7uid,Omnipopimp,He feels 1% as special as you all treat your imbeciles in chief like Obama and Biden.,1,0,2
lon5d2s,lol7uid,Totoronyx,It's like my friend who is always reminding every that he is super over his ex... He's not.,1,0,0
lon80hs,lol7uid,sohfix,he’s weirdly self aware…,1,0,1
londjtt,lol7uid,XanzMakeHerDance,![gif](giphy|3wCs5mlRqu8zm),1,0,0
lonkkuj,lol7uid,velvetcharlotte,His niece Mary Trump wrote a book about him and her unofficial opinion of him as a clinical psychologist is that he has multiple personality disorders. I can't remember which ones she listed in detail though,1,0,0
loo2tq3,lol7uid,Useful_Fun_6222,Yall need to stop. The current conditions under this admin or horrific. This dude may be off the chain but he’s the one dude that has a chance to fix this mess we got in the U.S. Kamala is a straight clueless clown.,1,0,2
loo632r,lol7uid,DeathShadowYT,The “only either” attitude doesn’t work,1,0,0
loocb9l,lol7uid,Buddhabellymama,As many times as a person who needs to tell themselves they won a debate no one told them they won,1,0,0
lood981,lol7uid,Raven_25,"Yeh but he's so humble and he doesn't want to make people feel dumb so he plays to the lowest common denominator. 

But because he's running for president, he has to remind the masses that he is indeed still a genius, just one that is humble. 

He's basically Jesus crissed with Einstein.",1,1,0
loofav7,lol7uid,OrgJoho75,Maybe a study on his brain composition post mortem would shed a light over his geniuses claim...,1,0,0
looptp9,lol7uid,Tiny_Addendum707,My mom claims he’s a genius. I laugh at her every time,1,0,1
loov1gr,lol7uid,Hrtpplhrtppl,"""He who joyfully marches to music rank and file has already earned my contempt. He has been given a large brain by mistake, since for him, the spinal cord would surely suffice. This disgrace to civilization should be done away with at once. Heroism at command, senseless brutality, the deplorable love-of-country stance, and all the loathsome nonsense that goes by the name of patriotism, how violently I hate all this..."" Albert Einstein",1,0,0
looy3nj,lol7uid,HypnonavyBlue,"Wile E. Coyote, and that's the whole list apart from him.",1,0,0
lop8n1q,lol7uid,jpopimpin777,"""Any man who must say, 'I am the king.' is no true king.""",1,0,2
loplk5g,lol7uid,moore112682,"Give me a moron and they will tell me everything they know

Give me a genius and they will tell me everything they don’t",1,0,2
lorplyr,lol7uid,tinglep,Kanye West.,1,0,0
lorrs59,lol7uid,Educational_Owl_9308,"So many geniuses are failed steak and vodka salesmen who also somehow bankrupted casinos, an airline and a mortgage company. Yep, total fucking genius.",1,1,2
loll1ih,lol7uid,CragMcBeard,They should study his pea size reptile brain when he finally chokes on his 5 billionth Big Mac.,1,0,2
lolcn0u,,UpsetAd5817,"She hitched her wagon to crazy. 

No sympathy.

I hope her legacy is forever connected to him and his stain upon the country.",349,0,2
lolfzwo,lolcn0u,Brief_Light,"Nah, she's also crazy and regressing all she can in Arkansas.",140,0,2
