comment_id,parent_id,comment_author,comment,comment_score,OPR,pos/neg view_b/hy
lolx8ce,,C_J_King,"This is what she sold her soul for. A babbling buffoon. 

Was it worth it Sarah? Life is long. Shame is hard to wash off.",5,0,2
lolmt5f,,W0tzup,"“If you can’t explain it simply, you don’t understand it well enough.”

-Albert Einstein",12,0,0
lolrlud,,Status_Cod1370,I need the Curb Your Enthusiasm theme to start as they start zooming in…,3,0,0
lom3sgn,,AfraidToBeKim,And somehow his fans are able to call this behavior something other than demented,4,0,2
lom75e3,,Disastrous_Carrot674,"Hey Sarah, it's hard to smile thru that ?? ??. isn't it?",6,0,2
lolg0br,,phillyhandroll,"Someone needs to tell him that he can't draw a clock, to trick him into testing himself for dementia. ",8,0,2
lol8737,,mattmanjblm,Somehow he’d figure out a way to convince himself that 1 + 1 = 3,4,1,2
lolo6ca,,ScorpioRising66,She reaps what she sows.,6,0,0
lom79g2,,Accomplished-Ad1919,Yet she still licks his taint.,3,0,2
lom7r9c,,nononsenseboss,"Dementia, word salad and narcissistic personality disorder, got all the bases covered.",4,0,2
lom8nb6,,testing543210,How is the crowd applauding this madness?,4,0,2
lolniok,,scimitar1312,I wonder if she ate the horse that kicked her in the face. Seems like the type to eat a horse,4,0,2
lole0mk,,Admirable_Network_49,Thinking about how she’s going to have to sell this shit as intelligent lol.,3,0,0
lole1g8,,Mindless_Air8339,Her smile is upside down. Geez Arkansas. You really know how to pick a winner,3,1,1
lolekb7,,D33ber,We've seen all these expressions on Huckabee Sanders' face before (when she has a shame faced right wing o'shizm. Usually while talk8ng to the press about children in cages.),3,0,0
lolenuy,,bophed,It’s a shame that his kids won’t save him from himself. I mean FFS. Put that man in a home or something.,3,0,2
lolizuf,,sirdizzypr,She can probably smell his diaper too. Also heard his body odor is so bad it’s gag wrenching. He’s a senile old riddled dementia nursing home runaway.,3,0,2
loljqt6,,Top_Salamander_1444,"She was so cringed out she tried to pop her head inside her body like a tortoise, but she failed",3,0,0
lollh5w,,TomGNYC,Those are the expressions you make when your soul is escaping from your body.,3,0,0
loloflr,,Herefortheparty54,That pig already sold her soul,3,0,2
lols1c3,,mozee880,"Her facial expressions!??

![gif](giphy|nmKBaZgcH8h20sQQI2)",3,0,1
lolv4py,,TarzanoftheJungle,"She's like, ""Everything's fine! Just humor him, please.""",3,0,1
lolyh5z,,BigChungusOP,So… how does Hannibal Lecter fit in all of this again? I’m still confused,3,0,0
lomlvw9,lolyh5z,Remarkable-Bar1394,That's Trump's spirit character.,3,0,0
lom3j2a,,Fresh_Swimmer_5733,She’s dying inside. Rightfully so.,3,0,0
lom5pbh,,SueBeee,She is complicit. Fuck her.,3,0,2
lom8c4q,,GuitarEvening8674,He's a Dr Evil kind of genius,3,1,0
lomjhnk,,bltn228,"I’d love to hear what she’s really thinking cuz her expressions are giving, Omg I’m so horrified",3,0,2
lomlb68,,tfpmcc,"If republican women could talk, oh the tales they would tale!",3,0,1
lomlqat,,drk_knight_67,Fucking guy is rambling while trying to explain he doesn't ramble.,3,0,2
lomlto5,,Massloser,That’s the expression of someone being smacked dead in the face with the realization they’ve sold any shred of dignity they may have had for an incompetent geriatric who can’t form a coherent thought let alone run the country. Will she do anything about it? Of course not. These people don’t care about anything beyond their own bottom line.,3,0,2
lomnkvw,lomlto5,baldycoot,"I wouldn’t bother anthropomorphizing her. If she were human, she might have some sort of self reflection in the moment. But insects don’t self reflect. The facial expressions are just those of a skin walker trying to stop the poorly fitting mask from sliding off.",1,0,2
londkk6,,nullbull,"The deeply engrained, fathomless depths of her dead-eyed ""yes dear"" smile, barely covering the silent scream by the rest of her body is just the saddest bit of patriarchy I've watched in a long time. Just yikes.",3,0,2
lonelo1,,kwyjibo1,"She is just as vile as he is, so they deserve one another.",3,0,2
long2be,,WeLoveThatForMe_2023,"Flint, Michigan can’t seem to catch a break. This damn fool comes to Flint, MI and vomits this word salad. ??",3,0,2
loo2r0i,,Formal-Echidna,That and she's probably smelling him,3,0,2
looh74x,,RootBeerTuna,"She hates her life right now, ??",3,0,1
looie8e,,BjornBergdahl,Thats a rambling...,3,0,0
looj5u0,,FerretsQuest,"Trump is clearly a genius - because he keeps on saying so himself.

I wonder how many other geniuses refer to their own state of genius?",3,1,0
look5kw,,Instabanous,"He wouldn't pass the most basic Job interview, for ANY Job.",3,0,0
lop5qj5,,steveslikewhoa,All the ozempic in the world couldn't rid SH of those chins,3,0,2
lopbfxl,lop5qj5,Troyger,You noticed that too huh? It gave me shivers down my spine,3,0,2
lold6b3,,Griplokz310,She’s so cringe ??,4,0,1
lolqiw5,lold6b3,JimmyJamesv3,![gif](giphy|xT9DPtO6zTqeQd1ct2),3,0,0
lomlsrz,lolqiw5,Griplokz310,??????,1,0,1
lolfjs4,,IcanSEEyou_IRL,Republicans are definitely planning on ganking him if he’s elected. They’re actually voting for Vance one 2025. That’s why the republicans have been doing the “attempts”,5,0,0
lolgo58,,Various-Group-8289,she knows she and he are frauds,5,0,0
lolgckz,,Temporary_Tune5430,They all despise him but have sold their souls. ,6,0,2
lolnd77,,NebulaCnidaria,Ugliest woman on the planet,5,0,2
lon9x9y,lolnd77,pondsy,Inside and out,2,0,2
lolftqm,,rawkguitar,"But she’s still going to vote for him, and still going to campaign for him",2,0,0
lolgjg3,,dolosloki01,[What have I done],2,0,0
lolgqox,,Noisebug,Is it just me or is this audio for ants?,2,0,0
lombtul,lolgqox,starscreamtrears,more like fleas. i was like. am i losing my hearing?,1,0,0
lolgrqc,,Ill-Case-6048,This can't be real if it is .. he needs a dr,2,0,0
lolh8dk,,wombat6168,He's a genius in his own head to the rest of us he's a prat,2,0,2
loli0kc,,Crime-Snacks,"Right off the top he rambles about a movie.

Says something about importing car plants.

“No that’s not rambling, that’s che-nius”

And he’s STILL in contention to be POTUS ??",2,0,0
loli7ga,,BornSoLongAgo,"Isn't that Huckabee-Sanders? She used to pretend to respect him when she was Press Secretary. Now she's throwing him to the wolves.

Can't stand the guy myself, but I can't stand a hypocrite like SHS either.",2,0,2
lolj5y6,,Lilithnema,She clearly looks uncomfortable and stupified.,2,0,2
lolleyz,,KickProfessional9491,Even Sarah just like jeez not the Hannibal shit again…,2,0,2
lollml1,,Heavymetalmusak,"If she’s there, who’s scaring our crows?",2,1,1
lolm1ak,,Few_Explanation1170,What in the word salad did he just say?,2,0,2
lolm5p3,,Lava-Chicken,Genianus,2,0,2
lolm6mv,,Basic_Life79,"Sarah's neck is melting down into her chest, she needs to just get that loose skin cut off already.",2,0,2
lolm77q,,doddballer,The look of someone who knows they’ve sold their soul,2,0,0
lolnz8v,,cobe656,Are we sure that’s just not how her face is?,2,0,0
lolp0rr,,Taltezy,Her turkey neck is crazy!!,2,0,1
lolpggh,,Offro4dr,Sarah Huckabee is that one girl in every Southern sorority. You know the one.,2,0,2
lolpzoh,,hoapaani,She’s a qunt. With smoky eyes.,2,0,2
lolq2x2,,ICUP1985,"“That’s not rambling, that’s genius!” 

Spoken like someone with a firm grasp on reality…/s.",2,1,2
lols0ga,,diamondtippedheart,"That's not wandering, that's genius. SMH. No sir, that's dementia with delusions of grandeur.",2,1,0
lolt4ho,,da_usual,Remember when she was the press secretary and then just kind of dipped out? yeah. I don’t know why anybody would vote for her. Another alternate facts dumbass liar.,2,0,2
lolxhvr,,MeepMeeps88,"Nah, she's just trying not to poop her pants from all the Ozembic ??",2,1,1
lolyc2w,,Bootyytoob,It’s a face of someone’s ethics dying,2,0,0
lolz9yb,,jeffssession,Was this recent??? That's bad when it comes to basic human capabilities. Everyone has to see that. (not American btw),2,0,0
lolza5v,,WildWilly2001,"“I’ll give this long, complex area”??? Wtf? His brain is mush.",2,0,2
lolzd7k,,ClassicCare5038,"He needs to step down, like BIDEN!!!",2,0,2
lolzhtj,,scranton_homebrewer,"Wait but can we talk about the subtitles autocorrecting Hannibal Lecter to Hannah Belekter? I’m dying, that’s got to be a drag queen name.",2,0,1
lom0g9n,,MrKomiya,She found the Ozempic huh?,2,0,0
lomm7jo,lom0g9n,Remarkable-Bar1394,"Yeah, but all her loose skin just hangs around.",1,0,0
lomqg0w,lomm7jo,MrKomiya,This snake can’t shed so easy huh?,2,0,2
lom0mpd,,_000001_,The dialogue sounds like it's coming from a new character invented by Sacha Baron Cohen or some other similarly effective piss-taking character comedian.,2,0,2
lom2t9x,,sloppy_sheiko,"Next time I get hammered and my wife tells me to stop explaining how my terrible fantasy football decisions are going to work out next weekend, I’m dropping the ‘Its not rambling, its genius’ line on her lol!",2,1,1
lom4sf1,,Sufficient-Cost5436,It's actually scary though that a man this senile and angry has so much power and money. If no from his party is stepping up to stop him now then they aren't going to do it if he wins the election and becomes president again.,2,0,2
lom5f8z,,DarthDregan,Sarah Sanders looks like every body part she has is trying to escape being Sarah Sanders.,2,0,2
lom6j2u,,Bags55,"Google William Kelly, Wharton Professor….said Trump was the dumbest god damn student I’ve ever had….",2,0,2
lom6o7r,,carlgt64,These Jesus-freak evangelical hypocrites deserve to be shamed for a hundred years or more for rallying around this pornographic criminal.,2,0,2
lom7601,,Scootchula,I want a lip reader to tell me what she says to herself at around 35-36 seconds.,2,0,0
lom76d7,,FaithIceberg,Hasn’t she always made those kind of faces though? Forced smiles and acting as if she’s paying attention.,2,0,2
lom825p,lom76oy,oddlymirrorful,What can I overspend on to hide my next trip.,4,0,0
lom92r1,,amey_zing1,He answers questions. Just not the ones he’s asked ??,2,0,0
lomejo1,,Sorry_Ad2690,The Neck at .23,2,0,0
lomfii3,,nevernate,"“That’s not rambling, it’s genius” was just icing on the dementia cake",2,0,2
lomgcmr,,MicellarBaptism,"Cue the ""Curb Your Enthusiasm"" theme.",2,0,0
lomi9yl,,lazermaniac,He's had a containment breach sitting down and she smells it.,2,0,2
lomifqv,,Kooky-Bandicoot1816,"And her responses to him were like placating a child. She had to reassure him after his rambling that he wasn’t rambling. Watch the town hall in Detroit with the AR gov, ugh. She is a POS",2,0,2
lomiif1,,Remarkable-Bar1394,Hannibal Lector is obviously Trump's hero.,2,0,2
lomijaf,,TeslaProphet,I hate you for making me look at her face.,2,0,2
lomixgw,,Granpa2021,"Dear God how, how, how does anyone think this man should be president?! WTF is wrong with you half of the U.S.?!?!",2,0,2
lomj9wq,,LaCalavera1971,He managed to make her eyes go even more crazy,2,0,2
lomjb3k,,DerivativesDonkey,She looks like a Hostage ?? Blink twice if you wish daddy was a Democrat!! ????,2,0,2
lomk1g6,,Hugh-Jassul,2 qunts,2,0,0
lomk4kh,,Top_Chard5757,That’s just her face. Her hate makes it weird,2,0,2
lomke5f,,john_kennedy_toole,I’ll give this long complex area.,2,0,0
lomktdf,,gadgaurd,"He went from Hannibal Lector to ambiguous plans to automobiles to fake news to his own ""genius""...in 40 seconds.

What the fuck is anyone supposed to take from that?",2,0,2
lomlaqe,lomktdf,ImNotYou1971,"He be weaving, don’t you know?",2,0,2
lomld6z,,Takethecannoli2,Pro liar cringing like they took away her Ozempic,2,0,2
lomlix7,,redfish801,The Ozempic is strong with that one.,2,0,0
lomlmwt,,Do_Whuuuut,Probably that rotten egg gas cloud hitting her and she's having flashbacks. Two horrible people.,2,0,2
lomlnhx,,Maddog351_2023,Why the I am here?,2,0,0
lomlttx,,Tay_Tay86,She's in the Donny stink cloud,2,0,2
lomm62r,,Apprehensive-Pop-201,She's a hateful cow.,2,0,2
lomob2b,,strange_stairs,"She has that Neanderthal brow ridge, huh?

![gif](giphy|aACeieARpEEE)",2,0,0
lompz71,,SuperChimpMan,He’s really one of the worst people of all time,2,0,2
lomsjso,,coolraul07,"Video editing gawds...

I beseech thee, edit this so that the slow zoom-in to her face includes the ending theme music to ""Curb Your Enthusiasm"".

In Photoshop's name, we pray.... A-do-be...",2,0,0
lomv6dn,,TheBirdsArePissed,She straight up tried to pull her turtle neck into her shell.,2,0,0
lomvms4,,techgnostic,"Screw her and everyone else supporting this idiot. Lay down with dogs, you get fleas.",2,0,2
lomx0ag,,HumulusLupulusNC,"“People that are coming in from SilenceOfTheLambs”

![gif](giphy|IvohnY91rCcKVBKBp5)",2,0,0
lon3xjv,,BocksOfChicken,Republican voters think this guy is a genius. What does that tell us about the level of intellect of Republican voters?,2,0,2
lon8joy,,jcned,"Damn, she looks like she’s in pain.",2,0,0
lon9s27,,girmus76,She’s such a Lydia.,2,0,2
loncygo,,Abject_Disaproval,"As I was reading this headline, the comment count was at 666.",2,0,2
londurs,,Big_Ad_1890,"I have found myself, once or twice, in a room with several of his supporters while he was speaking. In that scenario, it becomes easy to gaslight yourself and think “Did I miss something? This doesn’t make sense but, is it my fault it doesn’t make sense? Did I zone out for an important bit?”",2,0,0
lonei66,,Paradoxahoy,I love seeing the Magas try to cope with his incompetence,2,0,2
lonh64x,lonei66,TheGhostWithTheMost2,Same way yall were coping with Biden's for 4 years?,1,1,2
lopzdtk,lonh64x,Paradoxahoy,I always thought Biden was incompetent too lol who are you talking to?,1,0,2
loq5yip,lopzdtk,TheGhostWithTheMost2,Yall as a collective unit,1,0,0
longber,,Jrylryll,"The face is saying “oh god! What if he goes completely off. Can I bring him back? Dare I try? Just smile, he’ll finish”",2,0,2
longn5e,,TheKingofPsych,The Magats continue to follow a disgusting traitor sexual predator that can't even hold a conversation.,2,0,2
lonh3ar,,anomalkingdom,"Ho-ly shit. It's actually worse than I thought. Which says a lot. As a non american, I am absolutely floored by the fact that half the country wants *this* as their leader. And all those veterans and military personnel applauding this POS, they want *him* as their commander in chief!? What happened, everybody had a fckin stroke or something?",2,0,2
loniqs7,,Archadias28,"Is it just me, or does huckabee look like she’s on ozempic?",2,0,0
lonkyz6,,TedCruzisfromCanada,"She had the 

“tears streaming down her cheeks at the edge of the rooftop on Trump Towers wanting so badly to jump off to make the pain stop” 

face.",2,0,2
lonmda9,,NoCalHomeBoy,"Ugh, I can't look at that woman's face. She disgusts me...",2,0,2
lonmn4r,,Ok_Veterinarian9758,Hannah Belecter,2,0,2
loo1mz1,,D_dUb420247,She looks so uncomfortable.,2,0,2
loo31gr,,snork64,Fugly.,2,0,2
loo425p,,ProtectionContent977,That’s how her face is all the time.,2,0,2
loo7egz,,CallMeLazarus23,If shart wore a blue dress….,2,0,2
loo963j,,coqauvan,The sheer denial they are on is staggering. She tries to hide her disgust but fails miserably,2,0,2
looa6td,,lol1231yahoocom,Daddy taught her how to smile at the old man no matter what.,2,0,2
loodpfb,,xChoke1x,Is that the pig from Arkansas? She’s clearly been on the Ozempic train huh? Lol,2,0,2
looe3t2,,MutherDuckingGridman,I feel like this was a trick to get people to look at her face. Shudder,2,0,2
look5rt,,Sipjava,He's definitely redefining genius. It will not be long before the word will no longer will be used.,2,0,2
looldcn,,Jus-Wonderin9680,Maybe she's itchy.,2,0,0
loopzqf,,Key_Wing132,"Get fucked, people were saying the same damn thing about Biden and his ass still got elected",2,0,2
looqlai,,WiseChemistry2339,"People can’t hide their true feelings in their expressions. The gross part is she won’t just tell the fucking truth. She thinks he’s as big a douche bag liar as the rest of us do. It’s LITERALLY written all over her face. I Iove that expression because it’s always true. 

Grow a backbone and tell the truth.",2,0,2
loptgyr,looqlai,Amerlis,"Write a big enough check and you’ll find no end of people, standing with their back to a sunlit window, look you in the eyes and swear on their dear mother’s soul, it’s raining like crazy.",1,0,2
loosvnu,,Scorpiogre_rawrr,"Her neck in 4k

![gif](giphy|64y1b9lIU3nsS5kis6)",2,0,0
lop7g2b,,L0ST_N0UN,"I certain this man eats children. Unfortunately, it's not a joke at all. All the connections to child sex slavery and mentioning Hannable every chance they get. I honestly believe they have committed some horrible horrible things.",2,0,2
lophhko,,LuchadoresdeSilinas,"She is as shameless as her jerk father. You can see that as the orange turd rambles, she remembers to smile between winces and cringes. Sad how these scammers debase themselves.",2,0,2
loq2u4j,,tcumber,"Here we see Trump is not the problem...he is who he is. 

The problem is the 75 million people who, like Sarah Huckaby, just nod their heads and smile awkwardly, then go out and defend this bullshit.",2,0,2
loq3bmf,,formercolloquy,He doesn’t know the difference between people that need to claim asylum and people that are placed in an insane asylum.,2,0,2
loq3pl6,,Jackfreezy,"Didn't she put in her book that Trump tried to pimp her out to Kim Jong Un? I thought we lived in an era now where women were safe to speak up. I don't even like Sarah Huckabee but the level of discomfort people are willing to sit through just to be close to a moron is baffling, scary and impressive all at the same time.",2,0,2
loq4sds,,mightyFoo,politely eating shit face … priceless,2,0,2
loq8b6r,,gogenberg,Is there a YouTube clip of this? I want that.,2,0,1
loqiw5a,,QanAhole,This should be a campaign ad for Harris,2,0,1
loqplme,,Siliziumwesen,How in the fuck does he get supporters? Its stupid people isnt it? Why do I even ask,2,0,2
lolyahu,,teh_orng3_fkkr,He sure does talk a lot to say nothing,7,0,2
lom3rm5,,InevitablePassion521,Can anyone screen shot the 14 neck rolls huckabee has every time she looks down? She’s 42 and looks like a bag wet baby shit,3,0,2
lolnh25,,PolsBrokenAGlass,Guys he isn’t senile. He’s just a stable genius doing the weave,1,1,1
lonyunx,lolnh25,Mangosta007,WEARING a weave,2,1,1
loldhzo,,LightMission4937,"Iv seen more ""genius"" come out of a rotten potato. Jfc this orange skin tag is high off swamp gas from a gargoyles taint.",1,0,2
loldwd7,,Enough-Frosting7716,Wtf. Also him?,1,0,2
lolfksr,,NoScientist9175,"To be fair, her resting bitch face is top notch. So it’s hard to tell with her when she’s feeling a certain way",1,0,2
loli8jm,,Runnerakaliz,"I mean, she could have stopped it lol.",1,0,1
lolirqq,,Dkcg0113,"Either he’s senile, or he’s purposefully throwing the election",1,0,2
lolk39z,,PlantainNo2307,They say its a fine line between madness and genius.....yeah ??,1,1,1
lolkqd5,,BlkSubmarine,Is she making facial expressions or are all the Botox and fillers melting from the hot studio lights?,1,0,2
lollqiy,,TemporaryMindless519,She is not a skin walker or whatever the correct terminology is,1,0,1
lomnjmz,lollqiy,Remarkable-Bar1394,Skin walkers are afraid of her.,1,0,2
lolm9zq,,One_above_alll,She knows it’s all bullshit,1,0,2
lolmg7y,,3MTA3-Please,Dude in MAGA hat behind her could not be bothered to even pretend to seem interested,1,0,2
lon6pnh,lolmg7y,aripp,I thought he's sleeping but towards the end it seem like he's shaking his head a bit,1,0,2
lolmqfc,,bobby-blobfish,"Split screen please.
Just like the debate lol",1,0,0
lolnh6o,,SERVEDwellButNoTips,She is sh!tting bricks and her throat is going Mitch McConnell.,1,0,2
lolnigi,,SaintCholo,But why didn’t do this when he was in power 4 years?,1,0,2
lolnl07,,serpentear,"I’ve never seen someone look worse after starting ozempic, but these two are trying their best.",1,0,1
lolo5de,,antisocialnetwork77,I just can’t with this guy.,1,0,2
loloedp,,TriageOrDie,"Huckabee, Pence, Vance, Rubio, Cruz, the list goes on. An endless list of scyophants who kiss the ring while so clearly privately disdaining the man. 

It's somewhat cathartic to see these assholes reaping what they sow. 

Their own little private hell, constructed by their own lies and deception. 

Justice is a thing of a beauty.",1,0,2
lolpq04,,two-wheeled-dynamo,o.0,1,0,0
lolq65v,,Iflydryandsly,"Even moving her head around, she still managed to keep at least one eye on him",1,0,1
lolqc5b,,CardiologistNo616,Did that guy in the back fell asleep? The one in the white shirt MAGA hat,1,0,0
lomo2rv,lolqc5b,Remarkable-Bar1394,"He sleepwalks through his entire life, because that's what MAGAs do.",1,0,2
lolr47b,,FacelessFellow,"Reminds of a fella who would come in to McDonald’s and order a meager meal. Then he would spit talk at you about how smart he was and all the connections he had. Then he’d hop into his old, filled-to-the-brim hoarder truck, and ride off into the horizon, surely to return.",1,0,2
lolstmj,,Sad-Status-4220,It's like she just realized she supports a dumb ass.,1,0,2
lolt1a0,,ExcellentTeam7721,"It's a strategy that came from his father that DT has taken up and curated further. Never admit defeat. Say anything enough times, whether T or F, and enough people, for your purposes, will believe it.",1,0,2
lolt286,,lovelife0011,Grapefruit challenge,1,0,0
lolt4ba,,lovelife0011,Grapefruit challenge.,1,0,0
lolt5kj,,PomChatChat,She was slowly dying inside.,1,0,2
,,legallychallenged123,I don’t know. I’m fairly certain that’s just her face? You’re giving her too much credit.,1,0,2
loltgyd,,notmyrealnam3,I missed the immigration plot line within silence of the lambs?,1,0,2
loltnae,,StinkyPoopsAlot,When is this from?,1,0,0
loluawe,,AntiWhateverYouSay,Why is Hannibal lector being used?,1,0,2
lolulok,,SoundslikeDaftPunk,Lmao he’s rambling about the media saying he rambles,1,0,2
loluncy,,Milsurpsguy,There will never be an automobile built from any plant that he promises lol,1,0,2
loluyiy,,calsnowskier,He is clearly not sharp as a tack behind the scenes.,1,0,2
lolv8g1,,New_Lawfulness7015,Planes trains and automobiles ??,1,0,0
lolvtig,,HomerJayT,She’s trying to decide in her head if she should apply to McDonalds or Costco. That is the face of someone who is positive their career is over. She almost looks like a prisoner of his being forced to interview him.,1,0,2
lolvwbo,,Ticket-Intelligent,"I don’t think people understand just how carefully curated the image of a president is. They often use statistics and focus groups to find just the right things to say to get the most supporters, whether or not they actually believe it is a different story. Interviews with the president are only approved if the questions the interviewer can ask are carefully selected. That’s why I think Trump is probably the most honest president we’ve gotten is recent times, he get’s to be openly racist. I swear with every recent appearance on tv, he’s finding an excuse to rave about how bad immigrants are.",1,0,1
lolxaku,,AlliNAA1,"Libs in the comment section

![gif](giphy|6pJNYBYSMFod2)",1,0,0
lolxcg5,,Mortarion407,Two giant turds side by side.,1,0,2
lolxcmg,,Ts04795,"…And that, is how we’re gonna do it. Cam Brady O’ 12",1,0,1
loly0u1,,Orangealien81,I have a couple friends who I have no problem calling genius. You know what I've never heard them call themselves.,1,0,1
lolz886,,Born_OverIt,"Aunt Lydia got on that Ozempic, huh",1,0,2
lolz8aq,,UpsetPhrase5334,Hum shit sandwich…..,1,0,2
lom04pp,,scfin79,"Were they boo’ing him there? 

The crowd boo’ed (is that right?) him in Wilmington on Saturday.",1,0,2
lom0wmt,,therealmintoncard,"I hope she stays on her “Ozempic diet”. Hopefully she’ll get so thin, she just disappears entirely.",1,0,2
lom0x0q,,kr1681,He sounds like he’s spun out. Like he’s been up for five days on amphetamines,1,0,2
lom0xw3,,Virgohoney1,"Crazy these people still support him.. she would still be a Governors daughter without him, tho.",1,0,2
lom0y4x,,Sea-Pea5760,I can’t imagine the feeling of sitting there and then having that moment we’ve all had with something when you’re like “what in the actual fick is going on and how did I get here “,1,0,2
lom11yv,,Nelnamara,She threw up in her mouth at least three times,1,0,2
lom13wf,,Double0,Rambling again.,1,0,2
lom14jg,,Socially_Anxious_Rat,Vote please for the love of God vote. We can't have him in office again.,1,0,2
lom1775,,Smoov_82,Good. Let them eat the shit that comes out of his mouth.,1,0,2
lom1ec1,,Aggressive_Suit_7957,Good christians don't let friends vote for this excrement.,1,0,1
lom1j6d,,NetHacks,"I mean, after about 3 years of wiping his ass after press conferences, she mist have PTSD hearing this shit still.",1,0,2
lom226t,,Medic_Rex,Propaganda,1,0,2
lom2d5w,,burnmenowz,I wonder if she regrets selling her soul.,1,0,2
lom2ds7,,Quick_Swing,She looks like she is cringing and questioning her life choices at this moment.,1,0,2
lom2dyw,,crystalcastles13,A very stable genius :),1,1,1
lom2zet,,Wellsy,Brain damage is a helluva drug.,1,0,2
lom35j3,,Deehund,Those are the same looks melania gives him,1,0,2
lom367r,,katapiller_2000,GOP hates him.,1,0,2
lom36tc,,Justplayadamnsong,"When SHS thinks you’re full of shit, I don’t know what to tell ya - go ahead and give up. She’s sitting there reminding herself *ticket to the White House, ticket to the White House, ticket to the White House*. And as an Arkansas I say good riddance bitch.",1,0,2
lom3917,,blunderschonen,No thats just her trying to feign normal human emotions and immediately getting exhausted.,1,0,2
lom3d5n,,Formfeeder,Wholly molly,1,0,0
lom4imj,,Commercial-Berry8865,"She either has Tourette’s or is having a stroke, having to listen to this nonsense. We are all dumber having had to listen to that",1,0,2
