comment_id,parent_id,comment_author,comment,comment_score,OPR,pos/neg view_b/hy
lopc0ui,,Single_Nerve_7173,You've been telling us you're a genius since you've been on the scene. In all the years we've known you we still don't know what you mean.,1,0,2
lopd8ry,,OUTKAST5150,Jeannnneyuzzz,1,0,0
lopdfds,,PostReplyKarmaRepeat,She’s always had weird facial expressions. She’s just weird,1,0,2
lopeunm,,gaze-upon-it,Just like Wile E Coyote Super Genius,1,0,2
lopj6rd,,Joeyc710,Scared the shit out of me when she turned and looked at the camera. Straight horror.,1,0,2
lopki69,,MasChingonNoHay,She wants to throw up,1,0,2
lopls2n,,Valuable_Sea_9459,He did the Biden thing,1,0,2
lopmf88,,catharsisdusk,"It's like a bunch of neglectful relatives, putting on a show and smiling for the old man as he nears the end. All the while, hoping he leaves the The Country to them in his will.",1,0,2
lopp4f9,,greensburgcouple777,Her smugness is a show in its self,1,0,2
loppqce,,Patient_Tradition368,"Didn't she get in a bunch of trouble last year for trying to spend $20,000 on a podium?",1,0,2
lopsyjb,,whatever_leg,"Nah. She's just as ignorant, anti-human, anti-democratic, and power-seeking as he is.",1,0,2
loptrug,,freeedom123,she dying inside,1,0,2
loptvgn,,Comfortable_Prize750,"Her face always looks like that though. Like equal parts confusion, sadness, rage, and constipation.",1,0,2
lopu8on,,zennyc001,Rambling about rambling,1,0,2
lopuzp1,,SuccessfulAppeal7327,Watching these republicans roast as Trump has humiliated and brought them to heel is pretty satisfying. This is a Shakespearean character study of people letting madness take over for even a sniff of power.,1,0,2
lopw21x,,Master-Tomatillo-103,The quintuple-chinned bovine Huckleberry has been getting into the Ozempic,1,0,2
lopwok0,,Wizzle_Pizzle_420,You can see her mind just reflecting on all the decisions that have got her to this moment. “Why did I quit my childhood dream of being an artist?! Now I have to listening to an old wrinkled asshole talk about cat demons”.,1,0,2
lopwykv,,hartgekochteeier,Can God please FINALLY bless this broken country? Does anybody in the USA realize that their country lost SO MUCH respect because of this asshole? What the heck are you doing ffs??,1,0,2
lopyj6l,,Illustrious-Put3512,"Freedom of speech-a presidential candidate supports banning the filibuster, Right to own guns-a presidential candidate supports gun buybacks, Right to legal searches and seizures-a presidential candidate supports using the DOJ to go after political opponents and was successful in doing so and yes using an illegal search and seizure to do so. How much further down that list you want me to go. Wake up",1,0,2
lopz5nt,,serial-lain,He is a disease,1,0,2
loq1hbk,,Starrla423,"Sarah realized in that moment, she’s team Harris/Walz",1,0,2
loq2s9s,,iAmKeevee,Have you really been far even as decided to use even go want to do look more like?,1,0,2
loq7tao,,shootsy2457,Why is Uncle Fester on stage with Cheetolini?,1,0,2
loq8di8,,unused04,Even she is waking up to this moron being a pos,1,0,1
loq9fm0,,ImposterAccountant,Could grill him on plan spesific but then he woulf claim the moderator is out to get him and sabatage his campaigne. But he eould forget there was no moderator because he was speaking at an event.,1,0,2
loq9lje,,Available-Yam-1990,I'd say that's the best looking Sarah Huckabee Sanders I've seen. Though she still looks like Uncle Fester,1,0,2
loqg9jp,,Little_Can_728,I think that’s the look of “I better wake up this man is senile” ??,1,0,2
loqnjg0,,YOKi_Tran,$$$ buys a lot of buried feelings,1,0,2
loqpcn0,,No-Setting-2669,Holy shit.. huh?,1,0,2
lor2wxo,,deathtothenormies,He’s better at turning around his brain meltdowns than Biden. But I’d say give that 3-7 months and see if he isn’t bumbling and fully lost himself.,1,0,2
lor9eun,,myearlymorning,These stupid fucks hear Trump say 4 words in a row that they understand and start clapping and cheering.,1,0,2
lorjczc,,PieInternal6564,Can someone add The Sound of Silence to this?,1,0,0
lorll2y,,Used_Intention6479,"Sarah is developing ""Melania face"".",1,0,2
lornmit,,AlfalfaMcNugget,"It looked like she was enjoying the speech and was laughing along with the crowd.

Considering she worked with Trump during his presidency and owes a lot of her success to him, she seemed like she was enjoying her time on stage.

Boy, Reddit sure does miss the mark on a lot of things in the political zeitgeist!",1,0,2
loroijn,,bmorefly67,I think she has a case of the humbles ??,1,0,2
lorp7j2,,Suspicious_Humor_232,no judgement- wegovy or zepbound for these two??? i take one of them and its great!!,1,0,2
lorsab8,,Big-Neighborhood5395,Imagine a huckabee ozempic fart,1,0,2
lort1vv,,BlindedByBlite,She so desperately wants to be pretty and it ain’t gonna happen.,1,0,2
los25yz,,Hefty-Profession-567,All that ozempic and you still have 9 chins,1,0,2
losbxuz,,Puzzled_Falcon7818,His brain has been eating itself for a while,1,0,2
losllup,,Kevherd,Wow. Never witnessed a stroke in person before. Cool!,1,0,2
loszrh8,,ZiggysTingz,Did I hear booing?,1,1,2
lotcvqh,loszrh8,Sekhen,"They are booing ""mainstream media"".",1,0,2
lot5baj,,moderatorsareturds,![gif](giphy|COITV6uITjLchuwh43),1,0,0
lole1hm,,Icy-Commission974,Huckleberry Slander is sitting on his balls. He loves everything Trump says. He just didn’t tuck to the left this time.,-2,0,2
loncimq,,gukinator,This shit is cringe as fuck. Anyone who can't recognize this farse as a social dominance game rather than a political discussion has probably never observed a single intelligent conversation,0,0,2
lolat1w,,mrweatherbeef,"Not to be unkind, but she needs to get her neck done",-17,0,2
loldl7r,lolat1w,MoodShoes,"Nobody *needs* to get anything done. I'm not personally a fan of hers, but she's just a human being.",14,0,2
lon9ix2,loldl7r,pondsy,Debatable,1,0,0
loockjy,lon9ix2,5kaels,Dehumanizing people just makes shit worse.,1,0,2
lold249,,sirgeorgebaxter,"I hate trump like the next guy, but there has to be so much content out there. Why do we recycle the same damn videos?",-6,0,2
lon6jrb,lold249,Classic-Soup-1078,Because it editing a video clip is work. It's easy just to pull someone else's when you're making a meme.,1,0,0
lolpa6o,,Diligent_Bread_3615,I love how quickly you Libtards call Trump senile but denied it in Biden for 4 years. Classic!,-17,1,2
lomwbux,lolpa6o,cheetos305,Biden can speak in full sentences and read. Your boy can't do either. How retarded do you have to be to land in a cult for a treasonous traitor? He won't make it to November.,3,0,2
lomdz05,lolpa6o,BrewkakkeDrinker,"Dude we were saying it in 2012 with his birther bullshit, get with the fucking program.",6,0,2
lomgiwo,lomdz05,Diligent_Bread_3615,"2012??

WTF, maybe you need to get with the program. Why don’t you go stuff a ballot box somewhere.",-13,0,2
lomhd2z,lomgiwo,BrewkakkeDrinker,I'm an illegal trans alien who got my penis cut off in prison with your tax dollars and I'm gonna vote 500 times.,10,0,2
lomm1c5,lomhd2z,Diligent_Bread_3615,Calm down Becky!,-8,0,1
lommb83,lomm1c5,BrewkakkeDrinker,"No really though, fuck off with your election cheating bullshit.

With all the evidence right in front of your face that Trump was literally trying to steal the election, and you still accuse Democrats of it with no proof.

You're all anti-American trash and fucking traitors.",6,0,2
loo7qkr,lomgiwo,---THRILLHO---,"Yes, 2012 was when Trump was spouting off about birther conspiracy theories. I'm going to guess from your incredulity that you were too young in 2012 to be keeping up with American politics.",1,0,2
lonp33d,lolpa6o,Jonathon_world,You are in love with a guy who tried to overturn an election and destroy American democracy,1,0,2
loofgrl,lonp33d,Diligent_Bread_3615,"May I remind you of things like: Hillary is still saying she was robbed in 2016, Kamala rec’d’ zero (0) votes in the 2021 primary, two assassination attempts on Trump, hi-ranking FBI agents worked to defeat Trump, etc. etc.",1,0,2
lookpjq,loofgrl,Jonathon_world,Did hillary get a group of crazy mad people to go abs and hang mike pence no she didn't.,1,0,2
loostlw,loofgrl,warrenjt,">> Hillary is still saying she was robbed in 2016,

Hillary hasn’t spent years saying it was (thoroughly debunked) illegal voting that lost her the election. She didn’t call state officials in Georgia and tell them to make up votes for her. She didn’t help stage a coup to prevent the peaceful transfer of power and upend democracy as we know it. 

>> Kamala rec’d’ zero (0) votes in the 2021 primary

There was no primary in 2021 that Kamala was a part of. She was vice president in 2021. 

>> two assassination attempts on Trump

That have been condemned by democrats

>> hi-ranking FBI agents worked to defeat Trump

First of all, high*-ranking. 

Second, this didn’t happen. What you might be thinking of is James Comey announcing reopening the investigation into Hillary Clinton’s emails less than two weeks before the 2016 election, which undeniably had an impact of some degree on voters. She lost fair and square (as did Trump in 2020), but that absolutely had an effect. 

>> etc. etc.

Kinda ran out of steam there at the end, huh?",1,0,0
lop776a,loostlw,Diligent_Bread_3615,"Nope, didn’t run out of steam at all. 

There can be no doubt there was an organized coup to oust Biden from the 2024 election. 

While I can’t remember their names at the moment, the 2 lovebird FBI employees that were caught red handed via text messages planning on obstructing Trump’s 2016 election is undeniable. They were not low level FBI people.

Comey’s actions were done to clear Hillary before her expected 2016 win. Done so they could say she god been investigated & cleared by FBI. Thank God she lost….and in a spectacular fashion.

(Edited for spelling)",1,0,0
lolqlrw,,CapnSaysin,Reminds me of peoples faces when they were watching Jo Jo Biden,-11,0,0
lolqqb0,,RayPineocco,"Lots of stuff to criticize Trump for. But if you are criticizing him for his senility and were also a supporter of Biden, you’re just a hypocrite plain and simple.",-11,1,0
loq7njd,lolqqb0,open__skeptic,"Oh, so you're a Kamala supporter? You want Biden to step down so Kamala can take his place in the oval office even sooner. I like you're thinking, I'm with you brother let's make it happen.",1,0,1
lonh1fn,,Honorablemention69,You are all cringing at Trump talking about bringing work back to America but Kamala Drunk actually rambling on Oprah is A ok! ??,-1,1,2
lopovdo,lonh1fn,CryptoReindeer,"He's *always* talking about that kind of plans he has for this or that. He was already very clear that he had plans to save people jobs at several companies, notably in the oil and car industry, not to mention to make Mexico pay for the wall, or recently to end the War in Ukraine.

Here's the thing however. He never shares his supposed somehow always secret plans which are almost certainly imaginary and non existent, the rare times where he does it's an absolute joke that shows he has no clue what he's talking about and it doesn't even qualify as a plan, and either way, he somehow manages to get no results lmao. At best he gives some shitty childish excuse for why his plan didn't work, which is never his fault.

His plans to save people's jobs? Those people lost their jobs. His plans to make Mexico pay for the wall? Mexico didn't pay for the wall. His secret plans to end the War in Afghanistan within days of becoming president? The war kept going, and when asked later on, he said his plan was too cruel and he was too kind lmao. His secret plan now to end the war in Ukraine? Nobody knows, everybody guesses it's just submitting to Putin, but i'm gonna bet his so very secret plan which he somehow absolutely can't reveal until he hets elected for some very mysterious reason is not gonna happen either.

Fuck, i can make a secret plan right now to unite every country and bring prosperity to all and peace on earth and everyone will have a job and a house. It will take effect three days after i become president. No, nobody else can do it, and i can't tell you what the plan is.

I don't give a shit if either of them gets drunk on Oprah or in some bar or at home or wherever, as long as they're not full of shit.",1,0,2
lolc2bf,,anon-aus-42,"Now suddenly he is senile, and everyone was playing dumb pretending Joe the Potato was not senile?

Pathetic clowns",-38,0,2
lold2i1,lolc2bf,sdrawkcabmisey,"Who’s pretending Joe isn’t senile? He definitely is, but with how often trump opens his mouth while spouting out ten lies a minute, he’s probably gone senile too.",20,0,2
lolh6yq,lold2i1,Various-Group-8289,Trump was lying way before being senile,11,0,2
loljdfq,lolh6yq,sdrawkcabmisey,"Yeah, i feel like it’s just gotten more obvious now. He’s slipped up and made himself into a much bigger fool than usual by falling for the cat eating lie and such.",2,0,2
lomdy3i,lold2i1,sol_sleepy,"The LEFT. 

For 3.5 years he wasn’t…. Until the media told people it was “OK” to think he was senile and then suddenly he was senile",-11,0,2
loldf2j,lolc2bf,MoodShoes,"Joe always was the better option of two bad options. I, and my friends, who are all on the left, regularly made fun of Joe biden, but he was still LEAGUES better than Trump.",18,0,2
lolrvp9,lolc2bf,Notamong69,So you're just gonna pretend you didn't see this clip or any of the countless others over the last few months of this rambling nonsense about a fictional character? Tell me what he was talking about in this clip please?,5,0,2
lolhwlq,lolc2bf,Kazyole,"They're both senile. Trump isn't suddenly senile. He's been declining for years. Of the two, Biden would have been surrounded by competent bureaucrats who I'm confident would not end democracy if he got re-elected. I wasn't excited to vote for Biden, but between the two declining ~80 year olds he was clearly the better option.

When it became clear he couldn't handle another 4 years, Democrats applied pressure to get him to step aside. And he did a remarkable thing. He put the needs of the country over his own ego and threw his support behind Kamala. The GOP could have done that too. But they didn't. And Trump would never put the needs of the country over his own.

Joe isn't running anymore. There's only one senile old man in the race. So there's only one senile old man who is worth talking about at this point.",8,0,2
lonku6k,,billydrivesavic,I really hope the left isn’t trying to claim senile after the last 3 fucking years of someone’s grandfather that should be in a home being in office,-7,0,2
lonowaa,lonku6k,Zoktuy,Trump is obviously in cognitive decline.,6,0,2
lonqpix,lonowaa,billydrivesavic,Biden hasn’t been able to form a sentence since he was sworn in,-6,0,2
lonqxs4,lonqpix,Zoktuy,"And Trump can't form sentences now. 

You're not going to avoid the fact that Trump is obviously in mental decline by deflecting to Biden, who isn't running again.",5,0,2
lonsiyy,lonqxs4,billydrivesavic,Ima deflect as much as I want to cuz Trump misspelled coffee once and looked at the eclipse like a goober and got dragged about it all over the place but Biden constantly topples over and basically needs a leash for four years and everyone’s is like :) yeah but that other guy is banned off twitter,-5,0,2
lonsqj6,lonsiyy,Zoktuy,You're embarrassing yourself.,6,0,2
lont6ae,lonsqj6,billydrivesavic,"Ooooooooops

Idc. Know what I miss? Affording groceries 

If Kamala can make living comfortable be a thing again cool. 

If Trump does. Cool

I give a fuck which side is in office but I am pretty sick of the left acting like Biden wasn’t embarassing as hell for his entire term 


Wait wait wait. He did get hit with hard hitting questions like what type of ice cream he got

Chocolate chocolate chip :D",0,0,2
lonthis,lont6ae,Zoktuy,"What's Trump's plan to reduce the cost of groceries? 

Nothing. 
He doesnt have one. 

Get a fucking grip dude, Trump getting elected wouldn't magically improve your life.",5,0,2
lonuo93,lonthis,billydrivesavic,"All I know is life was peachy when me and my ex rented a house for cheap back in 2017. Bought a house together 2019. Broke up and I was able to buy a house by myself in 2020. Was ahead of bills lived comfy as hell and next thing I knew I had to pick and choose which bill to ignore for the month. 

And I’m sorry that’s not a coincidence 

It’s not just groceries it’s electric, gas, why did my internet bill go from $80 when I got my house to $130? 

The cost of living is fucking crap and you can’t deny that. There’s no way you can unless you make six figures then you’re chillin 


I make the same exact amount per hour as I did in 2020 but I’m struggling harder than I ever have today. 

Shame on my employer for not matching the cost of living but the bosses are buying Escalades n shit. But I digress 


All I want dude is to afford what I got as a middle class working man 

Again. I was chillin 2020. What the fuck",-1,0,2
lonuxph,lonuo93,Zoktuy,"The cost of living crisis is caused by corporate greed, not a magic lever in the oval office. 

If you think Trump and Republicans are going to do anything to reduce the funneling from money from the working class into the pockets of big business then pass the fucking blunt. 

Again, Trump being elected wouldn't magically improve your life. 

Get a grip.",5,0,2
loo1dad,lonuxph,billydrivesavic,"And again Kamala has technically been in office the entire time life has sucked. 

So her being elected won’t magically improve shit either. 

The whole thing fucking sucks and I hate it.

also, get a grip? 

The only people I know that doesn’t have a grip are the ones that don’t remember how fucking easy it was to live 2016-2021

I know so many people that are like “I’ve never voted before but I’m voting this year”

2020 you know which side someone landed on when they are like “go vote! ?? it’s so important to go vote omg”

Now it’s the opposite.",1,0,2
looaqse,loo1dad,Zoktuy,"You have to be a special kind of person to think Trump will magically make everything affordable for you. 

How will he do it? 
You don't know and you don't care. 

Meanwhile Harris has a plan to cap grocery price increases, the GOP calls it communism. 

You're embarrassing yourself by correlating ""Trump in office"" with ""I could afford shit"" when the reason you can't afford anything today is because corporate greed during the pandemic jacked the price of EVERYTHING up. 

For suck sake, look at the profits of every major business over the last 4 years and see they have increased exponentially while wages stagnated. 

Corporate greed is why cost of living is so bad. 

For the last time, get a fucking grip.",1,0,2
loobnzc,looaqse,billydrivesavic,"Funny enough the left were the ones that so badly wanted the planet to shut down cuz of the flu which is what fucked everything up. Trump was out of office 2020. Height of the pandemic was 2021. HM

Why hasn’t Biden and Harris capped the grocery prices four years ago? 

Again again the left is like stay home save a life. Billionaires suck rarara but also pay Amazon more and more. 

Real strange how billionaires doubled their net worth during the pandemic while the rest of us have been suffering but OMG ROE V WADE

you look at your receipts for the last 10 years look at what was affordable and then tell yourself to get a grip 

I made my mind up when I went to buy a pack of cheese and a pack of ham and I was asked to bounty up $17 about it.


The amount of family owned businesses that had to close cuz of the fuck ass pandemic is depressing. Meanwhile big chains thrived. 


Politicians were constantly caught not following their own fucking rules about it. 

Everything was cool years ago. Everything sucks now. I’m not embarrassing myself saying that 

I vividly remember paying $1.89 a gallon in 2018. And for the last four years gas has been floating around $4 except oh wait that’s wild it’s under $3 right before elections. Thanks Kamala! I should vote for you again",1,0,2
looc40p,loobnzc,Zoktuy,"Clowns like you are the reason the first lesson in Grade 9 science class is ""Correlation ? causation"". 

Because your entire reasoning is ""Trump was president and I could afford shit, therefore Trump is the reason I could afford shit!"" ??????

How did Trump make everything affordable? 
You don't know. 

How will Trump make everything affordable again? 
You don't know. 

You're an embarrassment.",1,0,2
loodv1k,looc40p,billydrivesavic,"I’ll rebuttal with why was life affordable from 2016-2021

Why hasn’t life been affordable since then til now?

What will Kamala do different that Biden did?


There is no answer. I don’t give a fuck if Trump is elected I just know if the same stupid cunt that’s already in office stays in office I’m going to have to sell my house in a year or be homeless 


Also is funny when Obama was in office gas was up near $4. What the fuck? I kinda get the president has fuck all to do with that but it’s awfully coincidental huh? 

Whoever makes life affordable again gets my vote. I’m not an embarrassment for that

And again I don’t know anyone that has had to pay bills for the last 4 years that want another 4 years of this bullshit 


The only ones that wanna vote Kamala that I know live at home and are too worried about abortion",0,0,2
lolf763,,Dogforsquirrel,I could see her running for VP or President someday. Not that she has my vote.,-2,0,2
lomti03,,ChesterGoodwomanizer,Love you Trump!! God bless you and your family!!,-2,1,1
lomuvhk,,Natural-Upstairs5991,"That’s no rambling, That’s genius",-2,1,1
lon0ba8,,glopezz05,Who gives a shit how she feels about it? Fuck off. She deserves nothing.,-2,0,2
lonrcdr,,Stunning_Tap_9583,"If anyone can spot a senile old candidate it isn’t reddit.

Your desperation is gross at this point",-2,0,2
loldm3r,,Chingina,"He rambles, he’s not senile. Put up Biden and his invisible chair in France, if you want to see senility on display. Lol",-25,0,1
lolmkgj,loldm3r,BornAfromatum,You just watched senility on display champ.,11,0,2
lolrrh3,lolmkgj,Chingina,"You can delude yourself, but not those of us with the ability to think critically. Lol",-10,0,2
lom5rzj,lolrrh3,BornAfromatum,Those of us who think critically aren’t voting Trump. It’s kinda your whole thing. Trump supporters are notoriously uneducated.,2,0,2
lolooqi,loldm3r,Understandinggimp450,"He's running against Harris, genius.",9,0,0
lolrtv4,lolooqi,Chingina,"Who’s the current president, dunce cap? Lmao",-4,0,2
lols1p0,lolrtv4,Understandinggimp450,The video is Trump currently campaigning against Harris. No one is voting for Biden this election. So your point is useless.,6,0,0
lols9er,lols1p0,Chingina,"The topic of the current president and his mental decline is the point, dreg. Thank god that trump is unburdened by what has been. Hahaha!!",-1,0,1
lolsgvb,lols9er,Understandinggimp450,"That's not the topic, dummy.",11,0,0
lolylcw,lolsgvb,Chingina,It absolutely is the topic of my comment thread.,1,0,0
lolzlmz,lolylcw,Understandinggimp450,"So, you brought up Biden as a whataboutism and you're sticking to it. Good job buddy.",7,0,0
loq6qo3,lolrtv4,open__skeptic,"Oh, so you're a Kamala supporter? You want Biden to step down so Kamala can take his place in the oval office even sooner. I like your thinking, I'm with you brother let's make it happen.",1,1,2
lolp0pp,loldm3r,ImJustSaying34,"Why? Biden isn’t running? We didn’t want a grossly old candidate and he made the right decision to drop out. Trump is the only old man now. Did any of what he said sound coherent to you? His stream of consciousness speech? 

Biden absolutely had mental decline at his age but he was just more coherent than Trump.",9,0,2
lolrxgq,lolp0pp,Chingina,"Who’s the current president, my trisomic friend?",-5,1,2
lolsk9f,lolrxgq,ImJustSaying34,But he isn’t running against Trump so why bring up Biden? Seems irrelevant to the conversation since Biden is retiring in 4 months.,5,0,0
lonp0k9,loldm3r,Jonathon_world,Kamala is better than a fuckin convict lol,1,0,1
lombm17,,Proof_Trifle_1367,"We all forgot that Biden did the same thing, and people still cheered. It's all just ""sports fans' politics""",-8,0,0
lomc30b,,SimplePomelo1225,It’s amazing u Morons are u ok with loving an old deranged chomo like Biden and his sidekick the goofy Kamala. Tell us what trump is what he is but I liked the country a hell of a lot more when he was running it. But Covid was the plan to remove him and yup u sure love what we have now. Freaking expensive everything,-7,0,2
lon7oyh,lomc30b,Classic-Soup-1078,"So what was it? The chaos? His weather reporting skills? His ideas on sanitizing the human body? 

Oh! You're going to say the economy....

Oh! The really good one he inherited from Obama and then destroyed?",2,0,2
lom8lnm,,ooglebaggle,Sounds normal to me ?????,-9,0,0
lon6vhm,lom8lnm,Classic-Soup-1078,"You're right, it does sound like Trump's normal incoherent babbling.",6,0,2
