comment_id,parent_id,comment_author,comment,comment_score,OPR,pos/neg view_b/hy
lon1yk7,lolfzwo,I_Draw_Teeth,"There's an interesting dynamic at play. The far right who have hitched their wagon to him have actual (deranged) beliefs, but Trump only believes in Trump.

The idea of a ""great leader"" who ""embodies the nation"" is core to their flavor of authoritarian nationalism. They've gone all in that he can be their fuhrer, but he doesn't give the tiniest shit about them or their ideals beyond how it can serve him.

They keep twisting their values to suit his whims. And now that the dementia is ramping up, their pretzeling is all the more tortured.",41,0,2
lonaky3,lon1yk7,Brief_Light,"Well said, I feel Harris is going to win and hopefully he gets swallowed up in endless legal cases and slowly disappeares from the zeitgeist, but remembered for his bullshit.",6,0,2
lolssff,lolcn0u,Testicleus,I enjoyed her pain.,41,0,0
lonlzer,lolssff,Typical-Arugula3010,Ditto - the cherry on top was she 'knew' he was a stark raving lunatic but couldn't work out why she felt that way !!! She is one dumb specimen !,3,0,2
lomqmyy,lolcn0u,mrsir1987,I just think it’s crazy how much work she has had done and is still just grotesque.,2,0,2
lon4ond,lolcn0u,nighthawkndemontron,Her craziness is generational. She's reacting to his dementia-riddled rant but she's just as psycho,1,0,2
lonvixb,lolcn0u,True-Anim0sity,Eh,1,0,0
lop0wrv,lolcn0u,FadedTiger49,Yup. That’s the face you make when crazy comes to cash all those checks that were written,1,0,2
loli6xa,,natener,She also looks like 6 people are arguing for control to operate her face remotely.,339,1,2
lomo5ju,loli6xa,Clever_Mercury,When you go through all six stages of grief and continue smiling like a sociopath.,27,1,2
lomb4cs,loli6xa,ChefInsano,Seriously though what the fuck is wrong with her face? Did she have a stroke or something?,48,0,2
lomdbea,lomb4cs,Topikk,She was panicking because at some point she was going to have to respond to whatever the fuck he thought he was talking about.,79,0,0
lomh5fb,lomb4cs,Scruff_Enuff,More evidence that she's really a couple hundred rats in a trench coat.,26,1,0
lompe0t,lomh5fb,ChefInsano,"![gif](giphy|DYB6Z6cTCWVe8|downsized)

She’s giving me big Edgar vibes.",20,0,0
lon0wh0,lomb4cs,Pristine-Assistance9,Her face is proof that we came from soup.,1,1,2
loocb9k,lomb4cs,Formal-Echidna,She's smelling him,1,1,0
lomgyo9,loli6xa,Mister_Remarkable,Body language tells no lies. In reality she hated every second of it. She kept forgetting to pretend to be interested and smile,8,0,0
lon6miq,loli6xa,FelneusLeviathan,Now lo0k here….,1,0,0
lon6otc,loli6xa,milefool,She looks like she is eating shit slowly and painfully in front of the public.,1,0,2
lopensf,loli6xa,Long_Procedure_2629,When you body that much Ozempic on the daily...shit happens,1,0,0
loqired,loli6xa,108wwarrior,The inside out people are having a war inside her head,1,0,0
lol7zcr,,Mundane_Profit1998,Is it his answers though? Or is it the fetid MacDonalds diarrhea wafting past her nose?,321,0,2
lole4xq,lol7zcr,god_himself_420,What’s the difference?,86,0,0
loldh7b,lol7zcr,Hot_Chapter_1358,She's trying not to show off her ozempic-sponsored turkey neck.,69,0,2
lon6g5s,loldh7b,Late_Sherbet5124,Turkey neck.... more like the skin from a 90 year old ball sack.,2,0,2
lomtjtq,loldh7b,kwit-bsn,![gif](giphy|waIUAncg9yYF1bbmo4|downsized),1,0,0
lonb1w2,loldh7b,Diligent-Jicama-7952,"yo man, Im a fatty titty fuck and ozempic is doing wonders for me. dont hate on what the pinnacle of humanity offers.",1,1,2
looho60,lonb1w2,kroch,I have yet to figure out the ozempic shaming trend? Like why are we mocking people for losing weight and making a positive change?,4,0,0
lopf2lt,looho60,Long_Procedure_2629,Because for a long time people with an actual medical condition it was created for couldn't get it because of the aforementioned self absorbed fatties,1,0,2
lolfw2y,loldh7b,bob696988,She definitely needs that Turkey neck fixed. Maybe she used to be a wrestler,-6,0,0
loltvmb,lolfw2y,thegreatbrah,Idk why the downvotes. That's funny as hell.,4,0,1
lolwi9n,loltvmb,bob696988,Because they don’t understand it has nothing to do with politics,3,0,0
lommis0,lol7zcr,Eelwithzeal,The diarrhea is probably why she is seated so far away. We know it has nothing to do with covid social distancing,2,0,0
lom8kku,lol7zcr,PhoenixandOak,Yes,1,0,0
lol9jwt,,ExtremeAssistance595,"I can’t stand this guy, and I’m not here to insult him or his party. But has anyone done a MOCA test on him? So much of what he says reminds me of my own father AFTER he was diagnosed with dementia. I know every one makes fun of Biden, and luckily he was convinced to drop out of a race he had no business being in, but is every one missing the signs that Trump is putting on full display?!",465,0,2
lolfdbh,lol9jwt,DunderFlippin,"They tested him, and they told him Sir, we haven't seen better results than these, tears in their eyes and everything.",417,1,1
lolpljr,lolfdbh,ohmyword,I heard they cheered for him too!,87,0,1
loltw1z,lolpljr,Significant_Sign_520,And cried,38,0,1
lomaf3n,loltw1z,Dacvak,I was there. We all clapped for 20 straight minutes.,34,1,1
lonoyqz,lomaf3n,fistingbythepool,Onlookers were masturbating during the testing.,1,1,1
loommla,loltw1z,Just_enough76,And clapped. The whole triage clapped,1,1,1
lolqnxk,lolfdbh,zendogsit,"Many people are saying I have the most dementia they’ve ever seen, no one has as much dementia as I do",51,1,1
looouo7,lolqnxk,Apprehensive_Row9154,"Many dementia people the BEST I am, no one dementias like mE.. they’re so happy, I told em..",3,1,1
lolquef,lolfdbh,businesslut,"Person, Woman, Man, Camera, TV",34,0,0
lom7bkf,lolquef,BannedByRWNJs,He loves lamp.,15,0,0
lomafhh,lom7bkf,businesslut,Are you just looking at things and saying you love them?,8,0,0
lomwkvb,lomafhh,TidpaoTime,Covfefe,3,0,0
lonjoe3,lomafhh,Surreply,That’s just Brick.,0,1,0
lom76uk,lolfdbh,BannedByRWNJs,"Big, strong gerontologists. They came up to him and said “Sir, you have the least dementia we’ve ever seen. No one has less dementia than you. It’s amazing how functional your brain is.” ",22,1,0
lom7un1,lom76uk,DunderFlippin,"""It's impressive, sir, practically you shouldn't be alive""",10,1,1
lom3ux3,lolfdbh,DarkBladeMadriker,"They said he aced the test with the extra credit, so he got a 105 on the test. The doctors said it was incredible no one has ever been less demented in the history of dementia, and they would know cause they were expert doctors.",11,1,0
lomgfxf,lom3ux3,asshatastic,Ordained ministers in the church of Later Doctor Saints,0,0,0
lomcozy,lolfdbh,richwat00,"He's been tested. He's been tested by the best doctors in the world. More tests than anyone. No one has ever been tested like that before, in the history of testing. You know how many tests? A LOT. It's incredible how much. And the Dr's said..You wouldn't believe what they said.. They said, it was amazing..they said, they had never seen anyone score higher on these tests EVER. He'll take even another test, if asked. He'll take it right now. But he hasn't been asked to take another test. They said he didn't need to take another test, because anyone who scored THAT HIGH on a test, doesn't need to take another test. So he doesn't understand what people keep talking about tests. It's incredible. They were amazed. They really were.",3,1,1
lomgs3j,lolfdbh,asshatastic,I was there. It’s all truer than anything I’ve ever experienced. They all cheered and clapped and chanted until they vomited rainbow fountains from their mouths and ears and rectums. It was amazing and very much a never again type trip.,2,0,1
lomikkd,lolfdbh,DVWhat,"And the people did cheer, so great was their joy. “YES! YES!” they cried, as the gospel was writ anew. And hence did they proclaim it to the world as their god would so decree, “PERSON MAN WOMAN CAMERA TV!”",2,1,1
lon42c4,lolfdbh,Mister_Remarkable,![gif](giphy|l4q8cJzGdR9J8w3hS|downsized),2,0,0
lolf6u5,lol9jwt,upvotefunkyouup,"He did and said he “aced it” but somehow I doubt that. 

https://www.forbes.com/sites/ariannajohnson/2024/01/18/trump-boasts-about-acing-hard-cognitive-test-heres-whats-on-those-tests/",87,0,0
lolu94r,lolf6u5,Significant_Sign_520,"Even if he did okay 4 years ago, it’s irrelevant. People can deteriorate very quickly. My mom doesn’t have dementia. But the difference between now and 4 years ago is very noticeable. Getting old sucks",31,0,2
lom92qj,lolu94r,BannedByRWNJs,"Yep. Some people age slowly and it’s noticeable over the years. Others are amazing deep into old age, everybody’s impressed with how well they’re holding up mentally and/or physically, and then almost overnight it’s like they fall off a cliff. ",5,0,0
lopa0w1,lolu94r,jpopimpin777,"Somebody did a side by side of his debate with Kamala and his debate with Hillary. It was night and day. I hate him with every fibre of my being but I could see how low info dumbasses could've gotten duped voting for him in '16. His words were still stupid but his command of them and his stage presence felt semi presidential. 

Now he's just a rambling dotard.",1,0,2
lolonxr,lolf6u5,Lockmasock,"He definitely aced it. It came back so positive you wouldn’t believe the score. Nobody has tested more positive. Nobody told him he was testing positive for dementia

![gif](giphy|VSoRPmlMaKR8xCmq7F|downsized)",39,1,1
lolubni,lolf6u5,Pseudonyme_de_base,"I wish I could see the test and results, it should be obligatory to show tests like that so people can know what they're voting for",4,0,0
lolvm9z,lolf6u5,LupercaniusAB,"Eh, he could have aced it. My dementia addled mom aced it (30/30 score) when we first started worrying about it. It’s not a hard test, but it does test abstract thinking. The problem was that we *knew* something was wrong with our mom, but the test said she was fine. 10 years later she’s diagnosed with Alzheimer’s, and has about 10 seconds of memory. She still usually recognizes us anyway.",1,0,0
lolx9yg,lolf6u5,Kikikididi,he aced drawing a close and remembering 5 things,1,1,0
loojw8q,lolf6u5,USN_CB8,Then promptly says the wrong name of the doctor who gave him the test.,1,0,0
loli9f7,lol9jwt,Pliskin01,"Yes, they apparently have. 

[Person. Woman. Man. Camera. TV.](https://dandiamond.substack.com/p/the-truth-about-person-woman-man)

Not even how the test works.",23,0,0
lolt7gi,lol9jwt,JohnYCanuckEsq,"His dementia test results were all positive.

Of course, nobody will tell him what that really means.",14,1,0
lon1bwr,lolt7gi,MadMadBunny,He was so positive about it!,1,1,1
lom5u9d,lol9jwt,BannedByRWNJs,Is everyone missing the signs? No. Are millions of people *ignoring* the signs? Yes.,5,0,2
lom0oqu,lol9jwt,#NAME?,"I was never a huge Biden fan....but, by God, he earned a lot of respect in my book when he had the wisdom to see that he was no longer in top form. To spend a lifetime in public service, to ascend to the highest political position available, and then have the grace to say, ""I'm no longer the best person for this position."" Damn, man, that takes a lot of courage and selflessness. 

If they asked Donald Trump to be King-of-the-U.S.-for-Life tomorrow his only response would be, ""I can't believe y'all haven't ask me to do this sooner! Do you know how smart I am?!""

You'd be hard pressed to find two candidates who are more diametrically opposed in viewpoints or character.",2,0,0
lomfqn7,lol9jwt,carlosIeandros,"I have a hard time understanding wtf he's even saying. Listening to him talk is like reading those twitch copy pastas composed primarily in Korean and emojis, and then somewhere in the middle after a particularly long string of eggplants and helicopters, he throws in something about plants for making automobiles, and people start cheering.",2,1,0
lonekly,lol9jwt,LaikaZhuchka,"He honestly sounds like my schizophrenic mom did when she was off her meds. 

Not even sure this is dementia; it sounds a lot like mania. It wouldn't be unusual for him to be on some kind of amphetamine to give him energy, and the jumping from topic to topic could be a side effect of that.",2,0,0
lolzdsj,lol9jwt,kelpyb1,"They already did the “person, woman, man, camera, tv” test on him a few years ago, what more could possibly be done?",1,1,0
loo3dli,lol9jwt,nameproposalssuck,"They did a test for dementia on him and he's bragging till today about how he 'aced' that test and how 'nobody could do it' but him...

It would be funny if that that pos wouldn't run for president and is actually an icon for millions of dumbfucks out there.",1,0,2
looui6q,lol9jwt,RadlEonk,You’re kinder to Trump than I am.,1,0,0
lonfwnq,lol9jwt,uganda_numba_1,*everyone,0,0,0
lop4izi,lol9jwt,uganda_numba_1,Seriously: https://www.scribbr.com/commonly-confused-words/everyone-vs-every-one/,0,0,0
lolbivt,,Inedible-denim,"That's not rambling, that's ~~genius~~ **dementia**",151,1,1
lomct07,lolbivt,Proof_Trifle_1367,4 more years of dementia...... I think Americans finally learned to stop voting for old people,1,0,2
lomp0m0,lomct07,gretafour,I’m afraid that they’ve just learned to stop voting instead,2,0,2
lootqnq,lomp0m0,Proof_Trifle_1367,Oof.. I feel like you're referring to me.,0,0,0
loladm4,,frizzinghere,"How did he get to his status now, with him rambling and spouting nonsense like this? This really is a mystery.",100,0,2
loleumw,loladm4,alexredekop,"He was willing to say and do whatever his richest peers wanted of him. It is simply massive amounts of money combined with absolutely no ethics, backed by evil billionaires to get what they want.

That is the only reason.",60,0,2
lom8diu,loleumw,BelichicksBurner,"Nah, I wish it were that simple. Truth is, it's not the rich. It's working class whites. They connect with what they perceive to be0 realness, ridiculous as it sounds. 

His biggest advantage in politics is that he is so obviously not a politician. There's a massive section of the country that legitimately does not care about policies. They just don't trust any career politicians. Then along comes Trump, a man that a person who doesn't know a lot really only knows for being rich and famous. 

He comes out and runs his mouth, shooting from the hip on literally everything, regardless of how well versed he is or is not on the topic. This should and does turn off most educated people, who can quickly discern that he's just your typical 80s sleezeball businessman BSing he way through things. Problem is: a huge chunk of working class America is NOT well educated. So they see and hear all this and say ""this guy isn't a phony like the others"" because they perceive political speak as disingenuous. 

So, even though truthfully he's the biggest bullshitter of them all, to the less educated, he appears on the surface to be more genuine because he lacks political polish. His ignorance, his overt misogyny, and his slightly less overt racism in this weird way actually works for him because people think, ""No politician talks like this. He must be different!"" When in reality, he is different... but not in the way they think... he's not like the others in a very, very bad way. It's the kind of different that's legitimately dangerous. They don't see that. They just see someone not like the others and foolishly assume that must be a good thing.",5,0,2
lom8qtp,lom8diu,alexredekop,"Way over thinking it. Those are the victims being tricked into votes. 

He's THERE because of money and influential rich people. It's what all his policies and backers are based on. 

What the uneducated fail to realize is a secondary symptom here.",1,0,0
lomp2ql,lom8qtp,BelichicksBurner,"Nope. You misremember. He was actually frozen out by most of the top GOP donors early on. It wasn't until later the elites began to back him. Like it or not, his popularity growth was fairly natural.",0,0,0
lomql5r,lomp2ql,alexredekop,The Mercers were heavily involved in creating the entire campaign.,1,0,0
lom09x3,loladm4,savzs,the american education system is a joke. These dudes are literally banning books. It's insane dude this country is fucked up,1,0,2
lonhnj7,lom09x3,Psychonominaut,Ban books! Not guns!,1,1,2
lom6jag,loladm4,paarthurnax94,There's an entire right wing propaganda machine that cleans up his statements before reinforcing/programming them to his rabid base every night combined with a cult like following incapable of questioning what they've been conditioned to believe which is culled from a population that tend to believe in religion which fundamentally requires you to simply believe things just because it's expected of you or else you're ostracized from the group combined with 30+ years of right wing propaganda conditioning this same gullible group that the other side are actual devils and everything they say is evil incarnate and to blindly vote for the right wing because they must be the good ones by comparison on top of their general hatred for the fundamentals of the freedom that makes up the United States coupled with the exploitation of the fact right leaning people tend to base their identities on fear and power which sets them up perfectly to support fascism. Plus they're racist as shit and so is he.,1,1,2
lomepnn,loladm4,gismo4126,Pejoratively speaking... a 'Useful Idiot'.,1,1,2
lomg6z2,loladm4,Micah-B-Turner,southern strategy,1,0,0
lom1mbm,,Business_Usual_2201,"You can see her slowly dying inside....just like everyone who shills for that fraud

![gif](giphy|gVXdwG5Ps5sIjunskA|downsized)",41,0,2
lomkqtg,lom1mbm,historianLA,Who is he looking at? She turned sour as soon as she sees him looking at someone and then at the end he does a creepy ass tongue bite as she turns away disgusted.,5,0,2
lon8fzy,lomkqtg,Drago_Arcaus,His daughter maybe?,9,1,0
lol88ok,,kookie_kenj,Dementia Patient on the loose,86,0,2
lolgfq1,lol88ok,Perfect_Bench_2815,He is going to miss out on the applesauce! Complete with a cartoon movie.,10,1,1
loliazy,lolgfq1,Crime-Snacks,What’s worse is Matlock comes on first. His afternoon is ruined!,5,1,1
lolzq3d,loliazy,deleted,[deleted],0,0,0
lom6fct,lolzq3d,Crime-Snacks,"[MaaaaatLoooooock!!](https://m.youtube.com/watch?v=W99APLlpBnY)

I grew up watching old timey shows and was a huge Andy fan. I even watched Matlock as a kiddo.

The Matlock reference is from an older gag on the Simpsons.",1,0,0
lomb7u1,lom6fct,Born_OverIt,Thanks!,1,0,1
lom499t,lol88ok,Johnjarlaxle,He's literally weaponized dementia lol,1,0,1
lolc6ut,,Pork_Chompk,"> That's not rambling, that's genius.

I'm totally stealing that to use at work.",28,0,1
lombjvw,lolc6ut,TheStateToday,Sir have you heard about the Weave?,2,0,0
lolhi9q,,mrjuanchoCA,![gif](giphy|l2Jhw8Oo6kVRWvTZm),26,0,0
loleo88,,colcannon_addict,The fuck’s this obsession with Hannibal Lecter? He does know it’s a fictional character doesn’t he?,45,0,2
lolt3ls,loleo88,Pduke,"Best guess is that he hears immigrants are seeking ""asylum"" and he thinks that word means ""insane asylum"" and that's where the Hannibal Lector comments are from. He believes immigrants from insane asylums in Mexico are coming here to join our insane asylums",44,0,2
loma8ua,lolt3ls,BannedByRWNJs,Definitely. Had one of these dipshits complaining about our tax dollars building all these asylums for the immigrants to live in. I’m still not sure if it’s homegrown stupidity or propaganda coming from trolls whose first language isn’t English. ,11,0,2
lond47l,loma8ua,BretShitmanFart69,"I wish someone would ask him outright to explain what the connection was to Hannibal Lecter, just really make him spell it out out loud. 

Why he gets away with spouting this shit and everyone is just so worn down that they don’t ever question him on this shit, is beyond me. 

He literally says so much crazy shit that you can’t even keep track, and because there is so much bullshit and no one wants to deal with it, especially knowing that if questioned he will just lash out and change the subject, he gets away with it. 

I’m so fucking sick of it.",1,0,2
lon58l4,lolt3ls,aripp,"Yeah. In his world ""asylum seeker"" = immigrant seeking mental asylum.",3,0,2
lon7q6r,lolt3ls,Competitive-Spell-74,Followed up by “it’s genius”. Can't make the shit up,2,0,0
loq3itn,lolt3ls,lawl-butts,"It's not even a guess, listen to the video and he ""explains"" just that. in a word salad of absolute drivel.

""I'm using that as an example of *people that are coming in from* **silence of the lambs**... I use it, they say 'it's terrible' so they say so I'll give this loooong complex area for instance that I talked about a lot of different territory. The bottom line is I said the most important thing 'we're bringing more plants into your state and this country to make automobiles.' "" :|

yep, that entire thought process tracks....",1,0,2
loloxwm,loleo88,CowsWithAK47s,"We need to feed him some bullshit. All jokes aside, start a truth social account and get a history of spewing right wing hate...

Then eventually start commenting about ""Hannibal Lecter"", the Mexican immigrant who ate American victims. Name a few of them, etc.

Watch the day he confidently states that Hannibal was an illegal immigrant that ate his way to the US.",16,0,0
lom60b1,loloxwm,Ex-CultMember,"This is seriously right wing media right now. Any random, nutcase can post some some political nonsense on social media and, next thing you know, Trump, FOX News, and MAGA are spreading it like it's real news and using it has their talking points.",6,0,2
lond99u,loloxwm,BretShitmanFart69,"This is honestly what is actually happening. 

Just look at the Haitian thing. JD Vance basically admitted that this was a baseless rumor. They don’t even try to spin stories anymore, they create them out of nowhere routinely.",3,0,0
lomf4vj,loloxwm,sonsoflarson,"Or if truth social has that verification check like on X, have someone create a very convincing Hannibal Lector account that interacts with Trump. Then use those Deepfake videos to gaslight him into thinking Lector attended his rallies and fundraisers. I'm sure eventually he'll start believing he's a real person that was a major contributor to his campaign. 

Trump: Seriously people, I gotta thank my good friend Hannibal Lector. If it wasn't for the good Dr, I'm not sure I'd be here. He's been with me every step of the way.",2,0,0
looai6w,loleo88,HaZard3ur,He is more like Miggs...,1,0,0
loleasv,,Temporary_Tune5430,Ozempic face,42,0,2
lom9msl,loleasv,BannedByRWNJs,She’ll always be the Mucinex™? booger to me.,11,0,2
lomjqkr,lom9msl,Remarkable-Bar1394,I think she was the model for the booger.,1,1,2
lomqnii,lom9msl,wheel_builder_2,"No, she’s a Picasso painting….and a booger.",1,1,2
lop6d0e,loleasv,AdvancedSandwiches,"She sucks, but absolutely not cool to be shitty to everyone who has lost weight and might be insecure about it. ",1,0,2
lom7lca,loleasv,swampking6,"My girls been mewing, she’s almost smashable if you look from the profile view",-1,1,1
lomb797,lom7lca,TheStateToday,Lmao. I can't fix her. That's you dawg,4,0,1
loleyv9,lolb9f8,InspectorNoName,How old is she? I thought she was 50+.,15,0,0
lolieji,loleyv9,Craico13,"Sarah Huckabee Sanders is **42**.

[o_O](https://en.wikipedia.org/wiki/Sarah_Huckabee_Sanders)",22,0,0
lollyto,lolieji,Loveknuckle,You can tell her age by counting her neck rings when she looks down.,18,1,2
lolqlky,lollyto,DunDunnDunnnnn,I’m 45 and I don’t have a quintuple chin…yet,7,0,0
lomluly,lolqlky,gibs71,"Shit, that’s a double quintuple with cheese",2,0,1
lon31gm,lolieji,SpokenProperly,Holy shit. We’re the same age?! I always thought she was *much* older than me. ??,2,0,1
lolisbu,loleyv9,Pliskin01,42,3,0,0
lold8re,,BoltsandBucsFan,A love how republicans say Kamala slept her way to the top but vote for Sanders who clearly should not be in her current position.,13,0,2
lom9l08,lold8re,mistled_LP,This comment just happens to be directly under a gif of Bernie Sanders and I was so confused.,3,0,0
lomasp1,lom9l08,BoltsandBucsFan,??,1,0,1
lolxmyt,lold8re,Luckys0474,Maybe she slept her way to the top? Incest seems to be a feature for some republicans. Sorry for the visual.,5,0,0
lolxsid,lolxmyt,BoltsandBucsFan,??,1,0,2
lolq9l4,,Famous-Fennel-7014,That enbred bitch is just as dumb as drumpf,12,0,2
lomjbfx,,JoeMorgan76,"So we are just going to pretend that this spectacular idiot is just fit to be president. Are we really so out of mediocre white men that we have to settle for this as a choice with one of our political parties? Is there no one who can formulate a non coked up thought? 

Who thinks this moron is brilliant?",10,0,2
lolyj2e,,Calairoth,"""It's not rambling,"" he rambled.",12,0,2
loljlt9,,JackieTree89,"Fuck Huckabee too. All these people know he's batshit crazy and just go along with his lunacy, only because they share the same hateful, selfish, un-American views.",18,0,2
lolljcw,loljlt9,drood420,Fuckabee.,9,0,2
lols5oq,,saveyboy,![gif](giphy|4ce1TjDI7lSs1IiNOe|downsized),8,0,0
loluyhf,,Riuvolution,This guy is a freaking idiot.,8,0,2
lolmkyi,,SleeveBurg,"Trump is mentally ill. A textbook narcissistic. Plain as day. As much as I despise him, I can forgive him for that. I truly pity him deep down. 

However the people giving him a platform and supporting him, the Sarah Huckabees of the world, truly what is their excuse? 

There are plenty of traitors, crazies, fascists that reside in the United States. The only difference between one yelling at the sky and one actively being able to implement their policies and views are those people.",7,0,2
lolwmj0,,adiosfelicia2,She sold her soul to the devil. There is a cost.,7,0,2
lomddxk,lolwmj0,sol_sleepy,"He’s not the devil lol. He was already President, and life was better",-2,0,0
lolkefd,,LetsLoop4Ever,"Wow. If she had any self respect she would wish these recordings to never be seen, by anyone. You can literally see how much she hates herself.",14,0,2
